DBA Name,Inspection Date,Results,IS_JUNK_STORE,IS_REAL_GROCERY,HAS_PRODUCE_FLAG,Address,City,State,Zip,Violations,Latitude,Longitude,DBA_NAME_CLEAN,ADDRESS_CLEAN,geometry,Community,shape_area_left,area_num_1_left,AreaNumber,shape_len_left,IS_REVIEWED_REAL,REVIEW_NOTES,index_right,Community.1,shape_area_right,area_num_1_right,AreaNumber.1,shape_len_right
"A & D Live Chicken Poultry, Inc",2024-10-29,Pass,TRUE,FALSE,TRUE,2601 S Ridgeway Ave,CHICAGO,IL,60623.0,"40. PERSONAL CLEANLINESS - Comments: OBSERVED HANDLERS WITHOUT HAIR RESTRAINTS. INSTRUCTED PERSON IN CHARGE THAT ALL HANDLERS MUST WEAR A HAIR RESTRAINT. | 47. FOOD & NON-FOOD CONTACT SURFACES CLEANABLE, PROPERLY DESIGNED, CONSTRUCTED & USED - Comments: OBSERVED EXPOSED BRICK USED AS STABILIZER FOR PREP TABLES AND EQUIPMENT THOURGHOUT FACILITY, INSTRUCTED TO REMOVE BRICKS AND REPAIR EQUIPMENT AND MAINTAIN. | 53. TOILET FACILITIES: PROPERLY CONSTRUCTED, SUPPLIED, & CLEANED - Comments: NOTED TOILET ROOM DOOR DOES NOT CLOSE, INSTRUCTED TO REPIAR AND MIANTAIN. | 55. PHYSICAL FACILITIES INSTALLED, MAINTAINED & CLEAN - Comments: OBSERVED STAIRS LEADING TO BASEMENT BROKEN, INSTRUCTED TO REPAIR AND MAINTAIN. | 55. PHYSICAL FACILITIES INSTALLED, MAINTAINED & CLEAN - Comments: OBSERVED ACCUMULATED DEBRIS BEHIND THE EQUIPMENT AND ACCUMULATED FEATHERS ON THE CEILING IN THE CHICKEN COOP. INSTRUCTED TO CLEAN. | 55. PHYSICAL FACILITIES INSTALLED, MAINTAINED & CLEAN - Comments: OBSERVED CRACKED, BROKEN AND DAMAGED FLOOR TILES IN THE FRONT AND REAR PREP AREA. INSTRUCTED TO REPAIR TO CREATE A SMOOTH, EASILY CLEANABLE AND WATERTIGHT SURFACE. MUST MAINTAIN AT ALL TIMES. | 55. PHYSICAL FACILITIES INSTALLED, MAINTAINED & CLEAN - Comments: OBSERVED BASEMENT WALLS BROKEN WITH LARGE HOLES, NOTED WALL THROUGHOUT BASMENT WITH BLACK MOLD-LIKE SUBSTANCE. INSTRUCTED TO REPAIR WALLS, HOLES AND MAINTAIN ALL. | 56. ADEQUATE VENTILATION & LIGHTING; DESIGNATED AREAS USED - Comments: OBSERVED A MISSING LIGHT SHIELD IN THE CEILING LIGHT WITH WIRES EXPOSED, WHERE LIVE PULTRY IS HELD, PREP AREA, INSTRUCTED TO PROVIDE AND MAINTAIN AT ALL TIMES. | 56. ADEQUATE VENTILATION & LIGHTING; DESIGNATED AREAS USED - Comments: OBSERVED A BURNED-OUT LIGHT-BULB IN AREA WHERE LIVE ANIMALS ARE KEPT AND REAR PREP. INSTRUCTED TO REPLACE BULB AND MAINTAIN.",41.844240130251900,-87.7183034877943,A D LIVE CHICKEN POULTRY INC,2601 S RIDGEWAY AVE,POINT (-87.7183034877943 41.844240130251904),SOUTH LAWNDALE,127998297.867,30.0,30.0,49904.0452102,,,29.0,SOUTH LAWNDALE,127998297.867,30.0,30.0,49904.0452102
Cermak Produce,2024-10-10,Pass,FALSE,TRUE,TRUE,3311 W 26Th St,CHICAGO,IL,60623.0,10. ADEQUATE HANDWASHING SINKS PROPERLY SUPPLIED AND ACCESSIBLE - Comments: 6-301.14	 MUST PROVIDES HANDWASHING SIGNAGE AT ALL HANDSINKS ON PREMISE AND MAINTAIN.,41.844366728746,-87.7078980537844,CERMAK PRODUCE,3311 W 26TH ST,POINT (-87.7078980537844 41.844366728746),SOUTH LAWNDALE,127998297.867,30.0,30.0,49904.0452102,,,29.0,SOUTH LAWNDALE,127998297.867,30.0,30.0,49904.0452102
Mini Mercado La Betania,2024-09-05,Pass,FALSE,TRUE,TRUE,2800 S Tripp Ave,CHICAGO,IL,60623.0,49. NON-FOOD/FOOD CONTACT SURFACES CLEAN - Comments: INSTRUCTED TO CLEAN ALL UNUSED EQUIPMENT IN PREP AREA.,41.8403965367115,-87.73067501246,MINI MERCADO LA BETANIA,2800 S TRIPP AVE,POINT (-87.73067501246 41.8403965367115),SOUTH LAWNDALE,127998297.867,30.0,30.0,49904.0452102,,,29.0,SOUTH LAWNDALE,127998297.867,30.0,30.0,49904.0452102
"Quinto'S Market, Corp.",2024-08-14,Pass,TRUE,FALSE,FALSE,2459 S Millard Ave,CHICAGO,IL,60623.0,,41.8462971046045,-87.715916429549,QUINTOS MARKET CORP,2459 S MILLARD AVE,POINT (-87.715916429549 41.8462971046045),SOUTH LAWNDALE,127998297.867,30.0,30.0,49904.0452102,,,29.0,SOUTH LAWNDALE,127998297.867,30.0,30.0,49904.0452102
Le Fenix,2024-08-12,Pass,TRUE,FALSE,TRUE,2706 S Lawndale Ave,CHICAGO,IL,60623.0,"38. INSECTS, RODENTS, & ANIMALS NOT PRESENT - Comments: OBSERVED DEAD INSECTS, SPIDERS AND WEBS IN PLACE ON WINDOWSILLS THROUGHOUT FACILITY. INSTRUCTED TO REMOVE. | 51. PLUMBING INSTALLED; PROPER BACKFLOW DEVICES - Comments: NO SERVICE SINK ON PREMISE. INSTRUCTED TO INSTALL UNDER CITY PRESSURE WITH HOT AND COLD RUNNING WATER. | 55. PHYSICAL FACILITIES INSTALLED, MAINTAINED & CLEAN - Comments: OBSERVED CARPETED FLOORING THROUGHOUT FACILITY. INSTRUCTED TO REMOVE AND PROVIDE SMOOTH AND EASILY CLEANABLE FLOORS AND MAINTAIN. | 56. ADEQUATE VENTILATION & LIGHTING; DESIGNATED AREAS USED - Comments: MUST PROVIDE VENTILATION INSIDE TOILET ROOM AND MAINTAIN.",41.8422511330412,-87.7173210601435,LE FENIX,2706 S LAWNDALE AVE,POINT (-87.7173210601435 41.8422511330412),SOUTH LAWNDALE,127998297.867,30.0,30.0,49904.0452102,,,29.0,SOUTH LAWNDALE,127998297.867,30.0,30.0,49904.0452102
Mama'S Meat Market,2024-06-05,Pass,TRUE,FALSE,TRUE,3000 S Drake Ave,CHICAGO,IL,60623.0,"47. FOOD & NON-FOOD CONTACT SURFACES CLEANABLE, PROPERLY DESIGNED, CONSTRUCTED & USED - Comments: OBSERVED NO SPLASH GUARD ON HAND SINK LOCATED NEXT TO MEAT SLICER. INSTRUCTED TO PROVIDE ADEQUATE BARRIER THAT IS SMOOTH AND EASILY CLEANABLE. | 49. NON-FOOD/FOOD CONTACT SURFACES CLEAN - Comments: OBSERVED BLENDER IN FRONT PREP AREA NEAR HOT HOLDING WITH DRIED DEBRIS ON SURFACES. INSTRUCTED TO CLEAN AND MAINTAIN EQUIPMENT. | 51. PLUMBING INSTALLED; PROPER BACKFLOW DEVICES - Comments: OBSERVED FAUCET NECK ON 3 COMPARTMENT SINK WITH LEAK, INSTRUCTED TO REPAIR AND MAINTAIN IN GOOD CONDITION. | 56. ADEQUATE VENTILATION & LIGHTING; DESIGNATED AREAS USED - Comments: OBSERVED VENTILATION HOOD ADJACENT TO HANDSINK IN PREP AS WELL IN UNISEX TOILET ROOM INOPERABLE. INSTRUCTED TO REPAIR AND MAINTAIN IN GOOD CONDITION.",41.8388160623887,-87.7135648565188,MAMAS MEAT MARKET,3000 S DRAKE AVE,POINT (-87.7135648565188 41.8388160623887),SOUTH LAWNDALE,127998297.867,30.0,30.0,49904.0452102,,,29.0,SOUTH LAWNDALE,127998297.867,30.0,30.0,49904.0452102
Rodriguez Fruits & Vegetable,2024-05-16,Pass,FALSE,TRUE,TRUE,2458 S St Louis Ave,CHICAGO,IL,60623.0,"47. FOOD & NON-FOOD CONTACT SURFACES CLEANABLE, PROPERLY DESIGNED, CONSTRUCTED & USED - Comments: NOTED FROZEN FOOD INSIDE FREEZERS STORED INSIDE GROCERY STORE BAGS. INSTRUCTED TO STORE FOOD IN FOOD-GRADE BAGS ONLY AND MAINTAIN THEM. | 51. PLUMBING INSTALLED; PROPER BACKFLOW DEVICES - Comments: OBSERVED REAR PREP HANDSINK NEAR HOT GRILLS LEAKING FROM PIPING. INSTRUCTED TO REAPIR AND MAINTAIN IN GOOD CONDITION. | 56. ADEQUATE VENTILATION & LIGHTING; DESIGNATED AREAS USED - Comments: OBSERVED DAIRY COOLING UNITS IN GROCERY WITH BROKEN BULBS AND INSTRUCTED TO REPLACE AND INCREASE LIGHTING INSIDE EQUIPMENT. | 57. ALL FOOD EMPLOYEES HAVE FOOD HANDLER TRAINING - Comments: MUST PROVIDE FOOD HANDLER CERTIFICATES FOR ALL FOOD HANDLERS AND MAINTAIN ON SITE.",41.8463298609331,-87.7125513997306,RODRIGUEZ FRUITS VEGETABLE,2458 S ST LOUIS AVE,POINT (-87.7125513997306 41.8463298609331),SOUTH LAWNDALE,127998297.867,30.0,30.0,49904.0452102,,,29.0,SOUTH LAWNDALE,127998297.867,30.0,30.0,49904.0452102
Sonora Meats,2022-12-22,Pass,TRUE,FALSE,TRUE,4135 W 26Th St,CHICAGO,IL,60623.0,"47. FOOD & NON-FOOD CONTACT SURFACES CLEANABLE, PROPERLY DESIGNED, CONSTRUCTED & USED - Comments: OBSERVED WALK IN COOLER AND WALK IN FREEZER DOOR WITH GASKETS IN DISREPAIR AND PLASTIC BAGS BEING USED TO INSULATE. INSTRUCTED PERSON IN CHARGE TO PROPERLY REPAIR GASKET TO SEAL DOOR, REMOVE PLASTIC, AND MAINTAIN. | 49. NON-FOOD/FOOD CONTACT SURFACES CLEAN - Comments: OBSERVED BUILD UP OF FOOD RESIDUE ON FRAME AND HANDLES OF DELI COOLER COLD HOLDING UNIT. INSTRUCTED PERSON IN CHARGE TO CLEAN AND MAINTAIN. | 55. PHYSICAL FACILITIES INSTALLED, MAINTAINED & CLEAN - Comments: OBSERVED ITEMS STORED ON THE FLOOR THROUGHOUT REAR DRY STORAGE AREA AND IN WALK-IN FREEZER. INSTRUCTED PERSON IN CHARGE TO ORGANIZE AND MAINTAIN ALL ITEMS AT LEAST SIX INCHES FROM FLOOR. | 55. PHYSICAL FACILITIES INSTALLED, MAINTAINED & CLEAN - Comments: OBSERVED CEILING IN WALK IN FREEZER TO HAVE PAINT PEELING. INSTRUCTED PERSON IN CHARGE TO REPAIR AND MAINTAIN. | 55. PHYSICAL FACILITIES INSTALLED, MAINTAINED & CLEAN - Comments: OBSERVED DEBRIS AND DUST IN CORNERS OR SALES FLOOR AND REAR DRY STORAGE AREA. INSTRUCTED PERSON IN CHARGE TO CLEAN AND MAINTAIN.",41.84409440645,-87.7282571000266,SONORA MEATS,4135 W 26TH ST,POINT (-87.7282571000266 41.84409440645),SOUTH LAWNDALE,127998297.867,30.0,30.0,49904.0452102,,,29.0,SOUTH LAWNDALE,127998297.867,30.0,30.0,49904.0452102
Andy'S Grocery,2022-12-21,Pass,TRUE,FALSE,FALSE,2300 S Troy St,CHICAGO,IL,60623.0,"10. ADEQUATE HANDWASHING SINKS PROPERLY SUPPLIED AND ACCESSIBLE - Comments: OBSERVED NO HANDWASHING SIGNAGE AT HANDSINKS. INSTRUCTED PERSON IN CHARGE TO PLACE SIGNAGE AND MAINTAIN.  | 55. PHYSICAL FACILITIES INSTALLED, MAINTAINED & CLEAN - Comments: OBSERVED ITEMS STORED ON FLOOR IN BASEMENT AREA. INSTRUCTED PERSON IN CHARGE TO ORGANIZE AND MAINTAIN ALL ITEMS AT LEAST SIX INCHES FROM FLOOR.  | 55. PHYSICAL FACILITIES INSTALLED, MAINTAINED & CLEAN - Comments: OBSERVED SOME BUILD UP OF DEBRIS UNDER 3-COMPARTMENT SINK. INSTRUCTED PERSON IN CHARGE TO CLEAN AND MAINTAIN.",41.849873983973300,-87.704117376653,ANDYS GROCERY,2300 S TROY ST,POINT (-87.704117376653 41.849873983973296),SOUTH LAWNDALE,127998297.867,30.0,30.0,49904.0452102,,,29.0,SOUTH LAWNDALE,127998297.867,30.0,30.0,49904.0452102
Christiana Food Llc,2022-10-26,Pass,TRUE,FALSE,FALSE,2801 S Christiana Ave,CHICAGO,IL,60623.0,"36. THERMOMETERS PROVIDED & ACCURATE - Comments: OBSERVED NO THERMOMETER IN REACH IN COOLERS FOR MONITORING AMBIENT AIR TEMPERATURES. INSTRUCTED PERSON IN CHARGE TO OBTAIN THERMOMETERS FOR EQUIPMENT AND MAINTAIN.  | 49. NON-FOOD/FOOD CONTACT SURFACES CLEAN - Comments: OBSERVED BUILD UP OF DEBRIS ON INTERIOR OF REACH IN COLD HOLDING UNITS ON BOTTOM AND SIDES. INSTRUCTED PERSON IN CHARGE TO CLEAN AND MAINTAIN.  | 55. PHYSICAL FACILITIES INSTALLED, MAINTAINED & CLEAN - Comments: OBSERVED BUILD UP OF DUST AND DEBRIS IN BASEMENT AREA. INSTRUCTED PERSON IN CHARGE TO CLEAN AND MAINTAIN.",41.8407273414541,-87.7084420646886,CHRISTIANA FOOD LLC,2801 S CHRISTIANA AVE,POINT (-87.7084420646886 41.8407273414541),SOUTH LAWNDALE,127998297.867,30.0,30.0,49904.0452102,,,29.0,SOUTH LAWNDALE,127998297.867,30.0,30.0,49904.0452102
Aldi #30,2022-08-01,Pass,FALSE,TRUE,TRUE,3030 S Kedzie Ave,CHICAGO,IL,60623.0,"49. NON-FOOD/FOOD CONTACT SURFACES CLEAN - Comments: INSTRUCTED TO REMOVE ICE BUILD UP FROM SMALL WALK-IN FREEZER CEILING AND FAN COVERS.  CLEAN FAN COVERS IN WALK-IN COOLER TO REMOVE DUST OBSERVED. | 53. TOILET FACILITIES: PROPERLY CONSTRUCTED, SUPPLIED, & CLEANED - Comments: FOUND NO COVERED WASTE RECEPTACLES IN WOMENS WASHROOM; INSTRUCTED TO PROVIDE A WASTE RECEPTACLE WITH A COVER. | 55. PHYSICAL FACILITIES INSTALLED, MAINTAINED & CLEAN - Comments: THE FLOORS UNDER THE SHELVES AND IN CORNER AREAS OF THE WALK-IN COOLER AND WALK-IN FREEZER NEEDS CLEANING.  CLEAN THE FLOOR IN THE STORAGE AREA IN CORNER AREAS.",41.8381141517343,-87.704994464765,ALDI 30,3030 S KEDZIE AVE,POINT (-87.704994464765 41.8381141517343),SOUTH LAWNDALE,127998297.867,30.0,30.0,49904.0452102,,,29.0,SOUTH LAWNDALE,127998297.867,30.0,30.0,49904.0452102
Teloloapan Grocery Inc,2021-12-10,Pass,FALSE,TRUE,TRUE,2101 S California Ave,CHICAGO,IL,60608.0,"47. FOOD & NON-FOOD CONTACT SURFACES CLEANABLE, PROPERLY DESIGNED, CONSTRUCTED & USED - Comments: OBSERVED RAW WOOD SHELVING USED IN THE REAR DRY STORAGE ROOM. MUST SEAL, MUST BE SMOOTH AND EASILY CLEANABLE.",41.8536931166832,-87.6953581995544,TELOLOAPAN GROCERY INC,2101 S CALIFORNIA AVE,POINT (-87.6953581995544 41.8536931166832),SOUTH LAWNDALE,127998297.867,30.0,30.0,49904.0452102,,,29.0,SOUTH LAWNDALE,127998297.867,30.0,30.0,49904.0452102
Rigo'S Grocery,2020-11-24,Pass,FALSE,TRUE,TRUE,2858 S Lawndale Ave,CHICAGO,IL,60623.0,"39. CONTAMINATION PREVENTED DURING FOOD PREPARATION, STORAGE & DISPLAY - Comments: MUST INSTALL WASHABLE SPLASH GUARD ON REAR PREP HANDSINK WHERE MEAT PANS USED TO DISPLAY CASING ARE STORED AFTER WASH, RINSING, AND SANITIZING OR REMOVE. MUST MAINTAIN TO PREVENT SOURCES OF MISCELLANEOUS SOURCES OF CONTAMINATION. | 47. FOOD & NON-FOOD CONTACT SURFACES CLEANABLE, PROPERLY DESIGNED, CONSTRUCTED & USED - Comments: MUST REPAIR DEEP FREEZER DOOR (DUCT TAPE MENDED) IN REAR PREP AREA AND MAINTAIN. | 49. NON-FOOD/FOOD CONTACT SURFACES CLEAN - Comments: MUST CLEAN AND REMOVE ALL DRIED FOOD DEBRIS ON ALL HEAVY COOKING EQUIPMENT IN REAR PREP AREA. MUST MAINTAIN. | 51. PLUMBING INSTALLED; PROPER BACKFLOW DEVICES - Comments: OBSERVED HANDSINK LOCATED IN PREP AREA SLOW DRAINING. INSTRUCTED TO REPAIR AND MAINTAIN.",41.8389367452558,-87.7172305545734,RIGOS GROCERY,2858 S LAWNDALE AVE,POINT (-87.7172305545734 41.8389367452558),SOUTH LAWNDALE,127998297.867,30.0,30.0,49904.0452102,,,29.0,SOUTH LAWNDALE,127998297.867,30.0,30.0,49904.0452102
"Prince Food Market, Inc",2018-01-05,Pass,FALSE,TRUE,TRUE,2819 W Cermak Rd,CHICAGO,IL,60623.0,"32. FOOD AND NON-FOOD CONTACT SURFACES PROPERLY DESIGNED, CONSTRUCTED AND MAINTAINED - Comments: Inspector Comments: MUST ELIMINATE CRATES USED FOR POP STORAGE IN REAR STORAGE AREA AND PROVIDE SHELVING UNITS. | 33. FOOD AND NON-FOOD CONTACT EQUIPMENT UTENSILS CLEAN, FREE OF ABRASIVE DETERGENTS - Comments: Inspector Comments: MUST CLEAN DEBRIS FROM FRONT WINDOW SILLS. | 35. WALLS, CEILINGS, ATTACHED EQUIPMENT CONSTRUCTED PER CODE: GOOD REPAIR, SURFACES CLEAN AND DUST-LESS CLEANING METHODS - Comments: Inspector Comments: MUST REPAIR OR REPLACE BROKEN AND MISSING CEILING TILES NEAR FRONT WINDOWS.",41.8517813420728,-87.696344921384,PRINCE FOOD MARKET INC,2819 W CERMAK RD,POINT (-87.696344921384 41.8517813420728),SOUTH LAWNDALE,127998297.867,30.0,30.0,49904.0452102,,,29.0,SOUTH LAWNDALE,127998297.867,30.0,30.0,49904.0452102
"Fruteria Andys, Inc.",2015-12-28,Pass,TRUE,FALSE,FALSE,2658 S Trumbull Ave,CHICAGO,IL,60623.0,"36. LIGHTING: REQUIRED MINIMUM FOOT-CANDLES OF LIGHT PROVIDED, FIXTURES SHIELDED - Comments: OBSERVED NO LIGHT SHIELDS ON LIGHT BULBS OVER THE PRODUCE SECTION. INSTRUCTED TO PROVIDE. | 38. VENTILATION: ROOMS AND EQUIPMENT VENTED AS REQUIRED: PLUMBING: INSTALLED AND MAINTAINED - Comments: OBSERVED NO VENTILATION IN ONE OF THE WASHROOMS. INSTRUCTED TO PROVIDE.",41.8426957318603,-87.7112279884106,FRUTERIA ANDYS INC,2658 S TRUMBULL AVE,POINT (-87.7112279884106 41.8426957318603),SOUTH LAWNDALE,127998297.867,30.0,30.0,49904.0452102,,,29.0,SOUTH LAWNDALE,127998297.867,30.0,30.0,49904.0452102
Santos # 2 Food Mart,2014-12-05,Pass,TRUE,FALSE,TRUE,2859 S St Louis Ave,CHICAGO,IL,60623.0,"32. FOOD AND NON-FOOD CONTACT SURFACES PROPERLY DESIGNED, CONSTRUCTED AND MAINTAINED - Comments: SOILED CHIP DISPLAY UNITS ON SITE. REPLACE SAME. RAW WOOD STORAGE SHELVES ON SITE. PAINT/SEAL SAME. | 33. FOOD AND NON-FOOD CONTACT EQUIPMENT UTENSILS CLEAN, FREE OF ABRASIVE DETERGENTS - Comments: DISPLAY SHELVES NEED DETAILED CLEANING, FREE OF DUST.",41.8390235008984,-87.7120564779216,SANTOS 2 FOOD MART,2859 S ST LOUIS AVE,POINT (-87.7120564779216 41.8390235008984),SOUTH LAWNDALE,127998297.867,30.0,30.0,49904.0452102,,,29.0,SOUTH LAWNDALE,127998297.867,30.0,30.0,49904.0452102
Alvarado'S Food Market,2014-07-16,Pass,FALSE,TRUE,TRUE,2401 S Ridgeway Ave,CHICAGO,IL,60623.0,"32. FOOD AND NON-FOOD CONTACT SURFACES PROPERLY DESIGNED, CONSTRUCTED AND MAINTAINED - Comments: RAW WOOD SURFACES INCLUDING DISPLAY SHELVING, WALL UNITS, ETC. ON SITE. INSTD TO PAINT/SEAL SAME WITH NON TOXIC PAINT.",41.8479093565157,-87.7184056653329,ALVARADOS FOOD MARKET,2401 S RIDGEWAY AVE,POINT (-87.7184056653329 41.8479093565157),SOUTH LAWNDALE,127998297.867,30.0,30.0,49904.0452102,,,29.0,SOUTH LAWNDALE,127998297.867,30.0,30.0,49904.0452102
Club De Vida Saludable R.P.,2012-05-10,Pass,TRUE,FALSE,TRUE,3915 W 26Th St,CHICAGO,IL,60623.0,38. VENTILATION: ROOMS AND EQUIPMENT VENTED AS REQUIRED: PLUMBING: INSTALLED AND MAINTAINED - Comments: MUST INSTALL A UTILITY SINK WITH HOT AND COLD RUNNING WATER AND A BACKFLOW DEVICE FOR THE DISPOSAL OF WASTE WATER.,41.8441659498219,-87.7228111473277,CLUB DE VIDA SALUDABLE RP,3915 W 26TH ST,POINT (-87.7228111473277 41.8441659498219),SOUTH LAWNDALE,127998297.867,30.0,30.0,49904.0452102,,,29.0,SOUTH LAWNDALE,127998297.867,30.0,30.0,49904.0452102
Walmart Neighborhood Market #5646,2023-06-27,Out Of Business,TRUE,FALSE,FALSE,2551 W Cermak Rd,CHICAGO,IL,60608.0,,41.8518682716606,-87.690075121295,WALMART NEIGHBORHOOD MARKET 5646,2551 W CERMAK RD,POINT (-87.690075121295 41.8518682716606),SOUTH LAWNDALE,127998297.867,30.0,30.0,49904.0452102,,,29.0,SOUTH LAWNDALE,127998297.867,30.0,30.0,49904.0452102
"Bethlehem Food Market, Inc.",2023-05-15,Out Of Business,TRUE,FALSE,FALSE,3009 W Cermak Rd,CHICAGO,IL,60623.0,,41.85172137507,-87.7007859846572,BETHLEHEM FOOD MARKET INC,3009 W CERMAK RD,POINT (-87.7007859846572 41.85172137507),SOUTH LAWNDALE,127998297.867,30.0,30.0,49904.0452102,,,29.0,SOUTH LAWNDALE,127998297.867,30.0,30.0,49904.0452102
Meat Market & Grocery,2020-11-17,Out Of Business,TRUE,FALSE,FALSE,3537 W Cermak Rd,CHICAGO,IL,60623.0,,41.8515641572206,-87.7139282059147,MEAT MARKET GROCERY,3537 W CERMAK RD,POINT (-87.7139282059147 41.8515641572206),SOUTH LAWNDALE,127998297.867,30.0,30.0,49904.0452102,,,29.0,SOUTH LAWNDALE,127998297.867,30.0,30.0,49904.0452102
"A. N . Food Market , Inc.",2020-04-14,Out Of Business,TRUE,FALSE,FALSE,3222 W Cermak Rd,CHICAGO,IL,60623.0,,41.851866199023,-87.7060705256387,A N FOOD MARKET INC,3222 W CERMAK RD,POINT (-87.7060705256387 41.851866199023),SOUTH LAWNDALE,127998297.867,30.0,30.0,49904.0452102,,,29.0,SOUTH LAWNDALE,127998297.867,30.0,30.0,49904.0452102
"La Villita Food Market, Inc.",2020-04-08,Out Of Business,TRUE,FALSE,FALSE,2601 S Kedzie Ave,CHICAGO,IL,60623.0,,41.8444281019106,-87.7048918885585,LA VILLITA FOOD MARKET INC,2601 S KEDZIE AVE,POINT (-87.7048918885585 41.8444281019106),SOUTH LAWNDALE,127998297.867,30.0,30.0,49904.0452102,,,29.0,SOUTH LAWNDALE,127998297.867,30.0,30.0,49904.0452102
"In & Out Food Market, Inc.",2019-05-09,Out Of Business,TRUE,FALSE,FALSE,3028 W Cermak Rd,CHICAGO,IL,60623.0,,41.8519281250995,-87.7015200004509,IN OUT FOOD MARKET INC,3028 W CERMAK RD,POINT (-87.7015200004509 41.8519281250995),SOUTH LAWNDALE,127998297.867,30.0,30.0,49904.0452102,,,29.0,SOUTH LAWNDALE,127998297.867,30.0,30.0,49904.0452102
La Azteca Mini Market Inc.,2013-11-14,Out Of Business,TRUE,FALSE,FALSE,2700 S Ridgeway Ave,CHICAGO,IL,60623.0,,41.8424039504994,-87.7185505241177,LA AZTECA MINI MARKET INC,2700 S RIDGEWAY AVE,POINT (-87.7185505241177 41.8424039504994),SOUTH LAWNDALE,127998297.867,30.0,30.0,49904.0452102,,,29.0,SOUTH LAWNDALE,127998297.867,30.0,30.0,49904.0452102
Mi Querido Mexico Inc.,2023-10-11,Fail,TRUE,FALSE,TRUE,4072 W 26Th St,CHICAGO,IL,60623.0,"3. MANAGEMENT, FOOD EMPLOYEE AND CONDITIONAL EMPLOYEE; KNOWLEDGE, RESPONSIBILITIES AND REPORTING - Comments: OBSERVED NO VERIFIABLE EMPLOYEE HEALTH POLICY ON SITE AT TIME OF INSPECTION. LEFT TEMPLATE AND INSTRUCTED TO MAINTAIN COPIES OF VERIFIABLE HEALTH POLICY SIGNED BY ALL EMPLOYEES ON SITE AT ALL TIMES. PRIORITY FOUNDATION VIOLATION 7-38-010. NO CITATION ISSUED. | 5. PROCEDURES FOR RESPONDING TO VOMITING AND DIARRHEAL EVENTS - Comments: OBSERVED NO KIT AND PROCEDURE ON SITE FOR RESPONDING TO VOMIT AND DIARRHEA AT TIME OF INSPECTION. INSTRUCTED TO MAINTAIN KIT CONTAINING ALL NECESSARY SUPPLIES INCLUDING A SANITIZER RATED AS EFFECTIVE AGAINST NOROVIRUS ON SITE AT ALL TIMES. PRIORITY FOUNDATION VIOLATION 7-38-005. NO CITATION ISSUED.   | 10. ADEQUATE HANDWASHING SINKS PROPERLY SUPPLIED AND ACCESSIBLE - Comments: OBSERVED NO PAPER TOWEL AT EXPOSED HAND WASHING SINK IN WASHROOM. INSTRUCTED TO MAINTAIN PAPER TOWELS AT ALL EXPOSED HAND WASHING SINKS AT ALL TIMES. PRIORITY FOUNDATION VIOLATION 7-38-030(C). NO CITATION.   | 10. ADEQUATE HANDWASHING SINKS PROPERLY SUPPLIED AND ACCESSIBLE - Comments: OBSERVED NO HAND WASHING SIGNAGE AT HAND WASHING SINK IN WASHROOM. INSTRUCTED MANAGER TO PROVIDE.  | 33. PROPER COOLING METHODS USED; ADEQUATE EQUIPMENT FOR TEMPERATURE CONTROL - Comments: OBSERVED NO MECHANICAL REFRIDGERATION ON SITE. INSTRUCTED MANAGER TO PROVIDE AND MAINTAIN COOLER AT 41F OR BELOW. PRIORITY 7-38-005 NO CITATION ISSUED.  | 38. INSECTS, RODENTS, & ANIMALS NOT PRESENT - Comments: OBSERVED NO PEST CONTROL LOGBOOK AVAILABLE. INSTRUCTED MANAGER TO PROVIDE. LOGBOOK SHALL BE AVAILABLE UPON INSPECTION. PRIORITY FOUNDATION 7-38-020(C) NO CITATION ISSUED | 38. INSECTS, RODENTS, & ANIMALS NOT PRESENT - Comments: OBSERVED A 1/2 INCH GAP AT THE SIDE OF THE REAR EXIT DOOR; INSTRUCTED TO SEAL GAP TO RODENT PROOF DOOR TO PREVENT POSSIBLE RODENT ENTRY. | 38. INSECTS, RODENTS, & ANIMALS NOT PRESENT - Comments: OBSERVED SEVERAL LIVE FRUIT FLIES SCATTERED THROUGH OUT FACILITY. INSTRUCTED TO ELIMINATE INSECTS ACTIVITY IN ALL AFFECTED AREAS, PEST CONTROL SERVICE IS RECOMMENDED. PRIORITY FOUNDATION VIOLATION 7-38-020(A) NO CITATION   | 53. TOILET FACILITIES: PROPERLY CONSTRUCTED, SUPPLIED, & CLEANED - Comments: OBSERVED WASHROOM DOOR NOT SELF-CLOSING. INSTRUCTED MANAGER TO REPAIR SELF-CLOSING DEVICE ON WASHROOM DOOR.  | 54. GARBAGE & REFUSE PROPERLY DISPOSED; FACILITIES MAINTAINED - Comments: FACILITY DOES NOT HAVE A RECORD OF ANY CONTRACT WITH A WASTE DISPOSAL COMPANY. INSTRUCTED MANAGER TO PROVIDE PROOF OF A CONTRACT. PRIORITY FOUNDATION VIOLATION 7-38-020 (B) NO CITATION ISSUED",41.8443230893254,-87.7275119226655,MI QUERIDO MEXICO INC,4072 W 26TH ST,POINT (-87.7275119226655 41.8443230893254),SOUTH LAWNDALE,127998297.867,30.0,30.0,49904.0452102,,,29.0,SOUTH LAWNDALE,127998297.867,30.0,30.0,49904.0452102
La Princesa Grocery,2016-07-12,Fail,TRUE,FALSE,TRUE,3442 W 24Th St,CHICAGO,IL,60623.0,"2. FACILITIES TO MAINTAIN PROPER TEMPERATURE - Comments: 3-DOOR REACH-IN COOLER FOUND AT IMPROPER TEMPERATURE. AIR TEMP RECORDED AT 46.5F. ALL COOLERS USED TO STORE POTENTIALLY HAZARDOUS FOODS MUST BE CAPABLE OF MAINTAINING AN INTERNAL AIR TEMPERATURE OF 40 DEGREES OR LOWER. HELD FOR INSPECTION TAG PLACED ON UNIT. CRITICAL VIOLATION 7-38-005(A). | 3. POTENTIALLY HAZARDOUS FOOD MEETS TEMPERATURE REQUIREMENT DURING STORAGE, PREPARATION DISPLAY AND SERVICE - Comments: CHICKEN HOT DOGS-45.6F, SOUR CREAM-47.7F, EGGS-51.5F. ALL POTENTIALLY HAZARDOUS FOODS ON PREMISES MUST BE STORED AND HELD AT 40 DEGREE OR BELOW UNTIL SOLD. CRITICAL VIOLATION 7-38-005(A). | 18. NO EVIDENCE OF RODENT OR INSECT OUTER OPENINGS PROTECTED/RODENT PROOFED, A WRITTEN LOG SHALL BE MAINTAINED AVAILABLE TO THE INSPECTORS - Comments: NO PEST CONTROL LOG BOOK ON PREMISES FOR THE NEW BUSINESS, MUST PROVIDE. 100 MICE DROPPINGS FOUND ON PREMISES IN THE FOLLOWING AREAS: ON FLOOR ALONG THE BASES OF THE WALLS ON SALES FLOOR, ON FLOOR AREAS UNDERNEATH 3 COMPARTMENT SINK, UNDERNEATH EXPOSED HAND SINK, IN WASHROOM AND IN MOP SINK AREA INSIDE WASHROOM, ONWINDOW SEATS IN FRONT AREA UNDERNEATH ALL FRONT WINDOWS, AND ON STORAGE SHELVES THROUGHOUT. ALSO OBSERVED 4 LIVE FLIES ON PREMISES. MUST CLEAN AND SANITIZE ALL AFFECTED AREAS AND HAVE ALL AREAS SERVICED BY PEST CONTROL COMPANY. SERIOUS VIOLATION 7-38-020. | 30. FOOD IN ORIGINAL CONTAINER, PROPERLY LABELED: CUSTOMER ADVISORY POSTED AS NEEDED - Comments: ALL FOOD ITEMS PACKAGED ON PREMISES AND PLACED ON DISPLAY FOR SALE, MUST BE PROPERLY LABELED WITH: BUSINESS NAME AND ADDRESS, NAME OF PRODUCT, AND INGREDIENT(S). | 32. FOOD AND NON-FOOD CONTACT SURFACES PROPERLY DESIGNED, CONSTRUCTED AND MAINTAINED - Comments: REPLACE ALL HEAVILY OIL-STAINED CHIP TRAYS ON SALES FLOOR. | 33. FOOD AND NON-FOOD CONTACT EQUIPMENT UTENSILS CLEAN, FREE OF ABRASIVE DETERGENTS - Comments: CLEAN THE FOLLOWING: ALL FOOD AND NON-FOOD DISPLAY SHELVES ON SALES FLOOR, ALL COOLERS AND PERSONAL REFRIGERATOR ON SALES FLOOR. ALL SINKS, AND ALL OTHER UNCLEAN SURFACES THROUGHOUT. | 34. FLOORS: CONSTRUCTED PER CODE, CLEANED, GOOD REPAIR, COVING INSTALLED, DUST-LESS CLEANING METHODS USED - Comments: CLEAN ALL FLOORS THROUGHOUT UNDERNEATH AND BEHIND ALL HEAVY EQUIPMENT(COOLERS, REFRIGERATORS, UNDERNEATH ALL SINKS(DIRT, DROPPINGS). | 35. WALLS, CEILINGS, ATTACHED EQUIPMENT CONSTRUCTED PER CODE: GOOD REPAIR, SURFACES CLEAN AND DUST-LESS CLEANING METHODS - Comments: CLEAN DEBRIS FROM LIGHT SHIELDS THROUGHOUT WHERE PRESENT. | 36. LIGHTING: REQUIRED MINIMUM FOOT-CANDLES OF LIGHT PROVIDED, FIXTURES SHIELDED - Comments: REPAIR OR REPLACE BLOWN LIGHTS(3) ON SALES FLOOR. | 37. TOILET ROOM DOORS SELF CLOSING: DRESSING ROOMS WITH LOCKERS PROVIDED: COMPLETE SEPARATION FROM LIVING/SLEEPING QUARTERS - Comments: ATTACH A SELF-CLOSING DEVICE TO EMPLOYEE WASHROOM DOOR. | 38. VENTILATION: ROOMS AND EQUIPMENT VENTED AS REQUIRED: PLUMBING: INSTALLED AND MAINTAINED - Comments: PROVIDE 3 STOPPERS FOR 3 COMPARTMENT SINK. MUST PROVIDE A DRAIN BOARD AT 3 COMPARTMENT SINK.",41.8481668391528,-87.7117213572077,LA PRINCESA GROCERY,3442 W 24TH ST,POINT (-87.7117213572077 41.8481668391528),SOUTH LAWNDALE,127998297.867,30.0,30.0,49904.0452102,,,29.0,SOUTH LAWNDALE,127998297.867,30.0,30.0,49904.0452102