DBA Name,Inspection Date,Results,IS_JUNK_STORE,IS_REAL_GROCERY,HAS_PRODUCE_FLAG,Address,City,State,Zip,Violations,Latitude,Longitude,DBA_NAME_CLEAN,ADDRESS_CLEAN,geometry,Community,shape_area_left,area_num_1_left,AreaNumber,shape_len_left,IS_REVIEWED_REAL,REVIEW_NOTES,index_right,Community.1,shape_area_right,area_num_1_right,AreaNumber.1,shape_len_right
Yado African And Carribean Market,2019-04-04,Pass W/ Conditions,TRUE,FALSE,FALSE,1651 E 87Th St,CHICAGO,IL,60617.0,"5. PROCEDURES FOR RESPONDING TO VOMITING AND DIARRHEAL EVENTS - Comments: 2-501.11 OBSERVED NO WRITTEN PROCEDURE NOR ADEQUATE SUPPLIES (DISPOSABLE MASK, DISPOSABLE RUBBER GLOVES, DISPOSABLE MOP) ON SITE TO RESPOND TO VOMIT AND DIARRHEA EVENTS THAT CAN POTENTIALLY OCCUR INSIDE OF THE FACILITY. INSTRUCTED TO PROVIDE. PRIORITY FOUNDATION 7-38-005. | 10. ADEQUATE HANDWASHING SINKS PROPERLY SUPPLIED AND ACCESSIBLE - Comments: 6-301.14 OBSERVED NO HAND WASHING SIGN LOCATED IN THE TOILET ROOM OR AT THE REAR HAND WASHING SINK. INSTRUCTED TO PROVIDE. | 53. TOILET FACILITIES: PROPERLY CONSTRUCTED, SUPPLIED, & CLEANED - Comments: 5-501.17 OBSERVED NO CLOSED RECEPTACLE INSIDE OF THE TOILET ROOM. INSTRUCTED TO PROVIDE.",41.7368389919252,-87.5831752984939,YADO AFRICAN AND CARRIBEAN MARKET,1651 E 87TH ST,POINT (-87.5831752984939 41.7368389919252),CALUMET HEIGHTS,48826241.5643,48.0,48.0,32925.3658706,,,47.0,CALUMET HEIGHTS,48826241.5643,48.0,48.0,32925.3658706
Oh Hen Mart,2025-04-28,Pass,TRUE,FALSE,FALSE,9053 S Stony Island Ave,CHICAGO,IL,60617.0,"39. CONTAMINATION PREVENTED DURING FOOD PREPARATION, STORAGE & DISPLAY - Comments:  OBSERVED BOXES OF CANDY STORED ON FLOOR BEHIND FRONT COUNTER. INSTRUCTED MANAGER TO ELEVATE ALL FOOD ITEMS SIX INCHES OFF FLOOR. | 41. WIPING CLOTHS: PROPERLY USED & STORED - Comments: OBSERVED SOILED WIPING CLOTHS STORED ON SINKS AND PREP TABLES. INSTRUCTED MANAGER TO STORE WIPING CLOTHS IN SANITIZING SOLUTION BETWEEN USES. | 49. NON-FOOD/FOOD CONTACT SURFACES CLEAN - Comments:  OBSERVED GREASE BUILDUP ON INTERIOR AND EXTERIOR SURFACES OF FRYERS, FOOD DEBRIS AND SPILLS ON INTERIOR AND EXTERIOR SURFACES OF COOLERS, SHELVING UNITS, COUNTERS SLICER IN PREP AREA. INSTRUCTED MANAGER TO CLEAN AND MAINTAIN. | 53. TOILET FACILITIES: PROPERLY CONSTRUCTED, SUPPLIED, & CLEANED - Comments: OBSERVED WASHROOM DOOR IN POOR REPAIR, NOT CLOSING PROPERLY. INSTRUCTED MANAGER TO REPAIR AND MAINTAIN. | 55. PHYSICAL FACILITIES INSTALLED, MAINTAINED & CLEAN - Comments: OBSERVED STAINED CEILING TILES, DAMAGED AND MISSING FLOOR TILES IN PREP, SALES, STORAGE, AND WASHROOM AREAS. INSTRUCTED MANAGER TO REPLACE CEILING TILES, DAMAGED AND MISSING FLOOR TILES IN ALL AREAS. | 56. ADEQUATE VENTILATION & LIGHTING; DESIGNATED AREAS USED - Comments:  OBSERVED GREASE BUILDUP ON FILTERS ABOVE FRYERS. INSTRUCTED MANAGER TO CLEAN AND MAINTAIN.",41.7298949621823,-87.5849087422939,OH HEN MART,9053 S STONY ISLAND AVE,POINT (-87.5849087422939 41.7298949621823),CALUMET HEIGHTS,48826241.5643,48.0,48.0,32925.3658706,,,47.0,CALUMET HEIGHTS,48826241.5643,48.0,48.0,32925.3658706
Pete'S Produce,2024-12-04,Pass,FALSE,TRUE,TRUE,1543 E 87Th St,CHICAGO,IL,60619.0,"10. ADEQUATE HANDWASHING SINKS PROPERLY SUPPLIED AND ACCESSIBLE - Comments: NO HAND WASHING SIGN AT THE REAR HAND WASHING SINK. INSTRUCTED TO PROVIDE AND MAINTAIN A HAND WASHING SIGN AT THE REAR HAND WASHING SINK. | 38. INSECTS, RODENTS, & ANIMALS NOT PRESENT - Comments: FLY STRIP HANGING IN THE REAR FOOD PREP AREA. INSTRUCTED TO REMOVE AND NOT HANG FLY STRIPS IN THE PREP AREAS. MAINTAIN SAME. | 53. TOILET FACILITIES: PROPERLY CONSTRUCTED, SUPPLIED, & CLEANED - Comments: NO SELF CLOSING DEVICE ON THE REAR TOILET ROOM. INSTRUCTED TO PROVIDE AND MAINTAIN A SELF CLOSING DEVICE ON THE TOILET ROOM DOOR. | 57. ALL FOOD EMPLOYEES HAVE FOOD HANDLER TRAINING - Comments: EXPIRED FOOD HANDLERS CERTIFICATES. INSTRUCTED TO OBTAIN AND MAINTAIN VALID FOOD HANDLERS CERTIFICATES.",41.736795457643,-87.5862725091306,PETES PRODUCE,1543 E 87TH ST,POINT (-87.5862725091306 41.736795457643),CALUMET HEIGHTS,48826241.5643,48.0,48.0,32925.3658706,,,47.0,CALUMET HEIGHTS,48826241.5643,48.0,48.0,32925.3658706
Corner Store,2011-03-14,Pass,TRUE,FALSE,FALSE,2639 E 93Rd St,CHICAGO,IL,60617.0,"35. WALLS, CEILINGS, ATTACHED EQUIPMENT CONSTRUCTED PER CODE: GOOD REPAIR, SURFACES CLEAN AND DUST-LESS CLEANING METHODS - Comments: The walls and ceilings shall be in good repair and easily cleaned.REPAIR WALL IN RESTROOM. | 38. VENTILATION: ROOMS AND EQUIPMENT VENTED AS REQUIRED: PLUMBING: INSTALLED AND MAINTAINED - Comments: Ventilation: All plumbing fixtures, such as toilets, sinks, washbasins, etc., must be adequately trapped, vented, and re-vented and properly connected to the sewer in accordance with the plumbing chapter of the Municipal Code of Chicago and the Rules and Regulations of the Board of Health. NEED TO PROVIDE  COLD WATER HANDLE  ON THE MOP SINK.",41.72620965100370,-87.5593000514696,CORNER STORE,2639 E 93RD ST,POINT (-87.5593000514696 41.72620965100369),CALUMET HEIGHTS,48826241.5643,48.0,48.0,32925.3658706,,,47.0,CALUMET HEIGHTS,48826241.5643,48.0,48.0,32925.3658706
Gennaro'S Meat Market,2023-11-08,Out Of Business,TRUE,FALSE,FALSE,1313 E 87Th St,CHICAGO,IL,60619.0,,41.736713258431,-87.5923943655359,GENNAROS MEAT MARKET,1313 E 87TH ST,POINT (-87.5923943655359 41.736713258431),CALUMET HEIGHTS,48826241.5643,48.0,48.0,32925.3658706,,,47.0,CALUMET HEIGHTS,48826241.5643,48.0,48.0,32925.3658706