DBA Name,Inspection Date,Results,IS_JUNK_STORE,IS_REAL_GROCERY,HAS_PRODUCE_FLAG,Address,City,State,Zip,Violations,Latitude,Longitude,DBA_NAME_CLEAN,ADDRESS_CLEAN,geometry,Community,shape_area_left,area_num_1_left,AreaNumber,shape_len_left,IS_REVIEWED_REAL,REVIEW_NOTES,index_right,Community.1,shape_area_right,area_num_1_right,AreaNumber.1,shape_len_right
Save A Lot #61314,2024-10-21,Pass W/ Conditions,TRUE,FALSE,FALSE,2858 E 83Rd St,CHICAGO,IL,60617.0,"5. PROCEDURES FOR RESPONDING TO VOMITING AND DIARRHEAL EVENTS - Comments: OBSERVED NO PROCEDURES AND SUPPLIES FOR RESPONDING TO VOMITING AND DIARRHEAL EVENTS. INSTRUCTED MANAGER TO PROVIDE AND MAINTAIN. PRIORITY FOUNDATION 7-38-005 | 10. ADEQUATE HANDWASHING SINKS PROPERLY SUPPLIED AND ACCESSIBLE - Comments: OBSERVED NO HAND WASHING SIGNS AT HAND WASHING SINKS IN PREP AND WASHROOM AREAS. INSTRUCTED MANAGER TO PROVIDE HAND WASHING SIGNS AT ALL HAND WASHING SINKS USED BY EMPLOYEES. | 38. INSECTS, RODENTS, & ANIMALS NOT PRESENT - Comments: OBSERVED 1/4"" GAP ON BOTTOM RIGHT CORNER OF REAR EMERGENCY EXIT DOOR. INSTRUCTED MANAGER TO SEAL ALL OUTER OPENINGS ON DOOR TO PREVENT PEST HARBORAGE. | 47. FOOD & NON-FOOD CONTACT SURFACES CLEANABLE, PROPERLY DESIGNED, CONSTRUCTED & USED - Comments: OBSERVED DAMAGED DOOR GASKET ON WALK-IN FREEZER. INSTRUCTED MANAGER TO REPAIR AND MAINTAIN. | 51. PLUMBING INSTALLED; PROPER BACKFLOW DEVICES - Comments: OBSERVED 3-COMPARTMENT SINK IN PRODUCE AREA SLOW DRAINING. INSTRUCTED MANAGER TO CLEAN DRAINS, REPAIR AND MAINTAIN. | 54. GARBAGE & REFUSE PROPERLY DISPOSED; FACILITIES MAINTAINED - Comments: OBSERVED DEBRIS NEAR DUMPSTER IN OUTSIDE GARBAGE AREA. INSTRUCTED MANAGER TO CLEAN AND MAINTAIN. | 54. GARBAGE & REFUSE PROPERLY DISPOSED; FACILITIES MAINTAINED - Comments: OBSERVED NO RECEPTACLE AT HAND WASHING SINKS IN PREP AREA. INSTRUCTED MANAGER TO PROVIDE RECEPTACLES IN ALL AREAS WASTE IS COMMONLY DISCARDED. | 55. PHYSICAL FACILITIES INSTALLED, MAINTAINED & CLEAN - Comments: OBSERVED UNUSED FREEZER IN SALES AREA. INSTRUCTED MANAGER TO REMOVE ALL UNNECESSARY ITEMS AND UNUSED EQUIPMENT TO PREVENT PEST HARBORAGE. | 55. PHYSICAL FACILITIES INSTALLED, MAINTAINED & CLEAN - Comments: OBSERVED CEILING NOT SMOOTH AND EASILY CLEANABLE IN PRODUCE PREP AREA. INSTRUCTED MANAGER TO PROVIDE SMOOTH AND EASILY CLEANABLE CEILING ABOVE PROCUCE PREP AREA. OBSERVED MISSING BASEBOARDS ALONG WALLS IN PREP AREAS. INSTRUCTED MANAGER TO REPLACE BASEBOARDS AND MAINTAIN.",41.7447308394738,-87.5540391375391,SAVE A LOT 61314,2858 E 83RD ST,POINT (-87.5540391375391 41.7447308394738),SOUTH CHICAGO,93272185.0092,46.0,46.0,52435.9794313,,,45.0,SOUTH CHICAGO,93272185.0092,46.0,46.0,52435.9794313
Abe Supermarket,2024-06-10,Pass W/ Conditions,FALSE,TRUE,TRUE,1935 E 79Th St,CHICAGO,IL,60649.0,"5. PROCEDURES FOR RESPONDING TO VOMITING AND DIARRHEAL EVENTS - Comments: NO VOMIT AND DIARRHEA CLEAN UP KIT ON PREMISES AS REQUIRED IN THE EVENT OF A VOMIT AND DIARRHEAL INCIDENT ON PREMISES; INSTRUCTED TO PROVIDE AND MAINTAIN.  PRIORITY FOUNDATION VIOLATION 7-38-005. | 53. TOILET FACILITIES: PROPERLY CONSTRUCTED, SUPPLIED, & CLEANED - Comments: NO SELF CLOSING DEVICE FOUND ON THE EMPLOYEE WASHROOM DOOR; INSTRUCTED TO INSTALL A SELF CLOSING DEVICE. | 55. PHYSICAL FACILITIES INSTALLED, MAINTAINED & CLEAN - Comments: OBSERVED FLOOR BEHIND FRONT CHECK OUT COUNTER OF RAW WOOD; INSTRUCTED TO PROVIDE TILE TO MAKE FLOOR SMOOTH AND EASILY CLEANABLE. | 55. PHYSICAL FACILITIES INSTALLED, MAINTAINED & CLEAN - Comments: OBSERVED AREAS OF THE LOWER WALL IN THE OFFICE AREA AND BY THE FREEZER STORING BAGGED ICE NOT COVED; INSTRUCTED TO PROVIDE A COVING AT THE BASE OF THE WALL. | 55. PHYSICAL FACILITIES INSTALLED, MAINTAINED & CLEAN - Comments: OBSERVED MISSING CEILING TILE IN THE WASHROOM; INSTRUCTED TO REPLACE TILE WHERE NEEDED.",41.7514836019125,-87.5770568614702,ABE SUPERMARKET,1935 E 79TH ST,POINT (-87.5770568614702 41.7514836019125),SOUTH CHICAGO,93272185.0092,46.0,46.0,52435.9794313,,,45.0,SOUTH CHICAGO,93272185.0092,46.0,46.0,52435.9794313
First Choice Market,2024-03-26,Pass W/ Conditions,FALSE,TRUE,TRUE,3019 E 91St St,CHICAGO,IL,60617.0,"23. PROPER DATE MARKING AND DISPOSITION - Comments: OBSERVED NO DATE MARKING ON REWRAPPED DELI MEATS, HAM, TURKEY, AND SOUSE. INSTRUCTED MANAGER TO PROPERLY DATE COLD READY TO EAT TCS FOOD STORED MORE THAN 24 HOURS WITH SELL BY DATE WITHIN 7 DAYS OF PREPARATION. PRIORITY FOUNDATIO 7-38-005 CITATION ISSUED | 38. INSECTS, RODENTS, & ANIMALS NOT PRESENT - Comments: OBSERVED 1/4"" GAP ON LEFT SIDE OF FRONT EXIT DOOR. INSTRUCTED MANAGER TO SEAL ALL OUTER OPENINGS ON DOOR TO PREVENT PEST ENTRY. | 43. IN-USE UTENSILS: PROPERLY STORED - Comments: OBSEREVED ICE SCOOP HANDLE LAYING ON ICE. INSTRUCTED MANAGER TO STORE HANDLE UP TO PREVENT CONTAMINATION. | 45. SINGLE-USE/SINGLE-SERVICE ARTICLES: PROPERLY STORED & USED - Comments: OBSERVED SINGLE SERVICE ARTICLES NOT INVERTED IN TAQUERIA. INSTRUCTED MANAGER TO INVERT ALL SINGLE SERVICE ARTICLES TO PROTECT FROM CONTAMINATION. | 47. FOOD & NON-FOOD CONTACT SURFACES CLEANABLE, PROPERLY DESIGNED, CONSTRUCTED & USED - Comments: OBSERVED NO STOPPERS FOR REAR 3-COMPARTMENT SINK. INSTRUCTED MANAGER TO PROVIDE ADEQUATE STOPPERS AND MAINTAIN. OBSERVED RUST DEPOSITS ON SHELVING UNITS INSIDE MEAT DISPLAY COOLERS. INSTRUCTED MANAGER TO REPLACE AND MAINTAIN. | 49. NON-FOOD/FOOD CONTACT SURFACES CLEAN - Comments: OBSERVED GREASE BUILDUP AND FOOD DEBRIS ON INTERIOR AND EXTERIOR SURFACE OF COOKING EQUIPMENT. INSTRUCTED MANAGER TO REPAIR AND MAINTAIN. | 50. HOT & COLD WATER AVAILABLE; ADEQUATE PRESSURE - Comments: OBSERVED INSUFFICIENT HOT WATER AT MULTIPLE SINKS, HAND WASHING SINK IN FRONT CORN PREP AREA (71.8F), HAND WASHING SINK IN FRONT COUNTER AREA (74F), HAND WASHING SINK IN WASHROOM (80.9F), HAND WASHING SINK IN MEAT PREP AREA (90.3F), HAND WASHING SINK IN MEAT WALK-IN COOLER (85.2F), HAND WASHING SINK IN EAST DISH WASHING AREA (89.5F), HAND WASHING SINK IN EAST WALK-IN COOLER (91.6F), 3-COMPARTMENT SINK IN TAQUERIA (103.3F), 3-COMPARTMENT SINK IN EAST DISH WASHING AREA(87.6F). INSTRUCTED MANAGER TO PROVIDE AT LEAST 100F WATER AT ALL HAND WASHING SINKS AND 110F AT 3-COMPARTMENT SINKS. PRIORITY 7-38-030(C) CITATION ISSUED | 51. PLUMBING INSTALLED; PROPER BACKFLOW DEVICES - Comments: OBSERVED LEAKING FAUCET ON REAR 3-COMPARTMENT SINK AND HAND WASHING SINK SLOWLY DRAINING INSIDE MEAT WALK-IN COOLER. INSTRUCTED MANAGER TO REPAIR AND MAINTAIN. | 55. PHYSICAL FACILITIES INSTALLED, MAINTAINED & CLEAN - Comments: OBSERVED UNUSED ARTICLES AND EQUIPMENT IN BASEMENT STORAGE AREA. INSTRUCTED MANAGER TO REMOVE ALL UNNECESSARY ITEMS TO PREVENT PEST HARBORAGE. | 56. ADEQUATE VENTILATION & LIGHTING; DESIGNATED AREAS USED - Comments: OBSERVED DAMAGED LIGHT SHIELD IN TAQUERIA AND MISSING LIGHT SHIELD IN TROPICANA REACH-IN COOLER IN TAQUERIA AND REAR WALK-IN FREEZER. INSTRUCTED MANAGER TO REPLACE AND MAINTAIN.",41.7299778711881,-87.5503825943664,FIRST CHOICE MARKET,3019 E 91ST ST,POINT (-87.5503825943664 41.7299778711881),SOUTH CHICAGO,93272185.0092,46.0,46.0,52435.9794313,,,45.0,SOUTH CHICAGO,93272185.0092,46.0,46.0,52435.9794313
South Shore Cellular & More Inc,2020-12-28,Pass W/ Conditions,TRUE,FALSE,FALSE,2541 E 79Th St,CHICAGO,IL,60649.0,"5. PROCEDURES FOR RESPONDING TO VOMITING AND DIARRHEAL EVENTS - Comments: OBSERVED NO WRITTEN PROCEDURES OR SUPPLIES FOR RESPONDING TO VOMITING OR DIARRHEAL EVENTS. SUPPLIES MUST INCLUDE ADEQUATE SANITIZER THAT ELIMINATES NOROVIRUS. INSTRUCTED FACILITY TO PROVIDE CLEAN UP POLICY AND SUPPLIES TO HANDLE BODILY FLUID SPILLS ON SITE PROPERLY.  PRIORITY FOUNDATION VIOLATION #7-38-005. NO CITATION ISSUED. | 36. THERMOMETERS PROVIDED & ACCURATE - Comments: OBSERVED NO AMBIENT AIR THERMOMETERS INSIDE THREE DISPLAY COOLERS UNITS. INSTRUCTED TO PROVIDE CONSPICUOUS AND EASILY READABLE THERMOMETERS INSIDE ALL REFRIGERATOR UNITS TO MONITOR THE AMBIENT AIR TEMPERATURE OF EQUIPMENT PROPERLY. | 47. FOOD & NON-FOOD CONTACT SURFACES CLEANABLE, PROPERLY DESIGNED, CONSTRUCTED & USED - Comments: OBSERVED RAW WOOD SHELVES ON REAR STORAGE RACKS. INSTRUCTED TO SEAL OR PAINT TO PROVIDE A SMOOTH AND EASILY CLEANABLE SURFACE. | 51. PLUMBING INSTALLED; PROPER BACKFLOW DEVICES - Comments: OBSERVED NO BACKFLOW PREVENTER DEVICE ON THE SINK IN THE REAR INTENDED AS THE UTILITY MOP SINK. INSTRUCTED TO INSTALL SO THAT IT CAN BE LOCATED, SERVICED, AND MAINTAINED. | 53. TOILET FACILITIES: PROPERLY CONSTRUCTED, SUPPLIED, & CLEANED - Comments: OBSERVED EMPLOYEE UNISEX WASHROOM DOOR TO NOT BE SELF CLOSING. INSTRUCTED TO INSTALL A SELF CLOSING DEVICE AND MAINTAIN AT ALL TIMES | 55. PHYSICAL FACILITIES INSTALLED, MAINTAINED & CLEAN - Comments: OBSERVED EXPOSED BRICK WALLS IN THE REAR STORAGE AREA OF THE FACILITY. GAPS AND CRACKS ARE VISIBLE BETWEEN THE BRICKS. INSTRUCTED TO COVER AND SEAL OPENINGS AS WALLS SHOULD BE SEALED, SMOOTH, AND EASILY CLEANABLE. | 55. PHYSICAL FACILITIES INSTALLED, MAINTAINED & CLEAN - Comments: OBSERVED CLUTTER IN THE FORM OF OLD/USED HARDWARE IN STORAGE CLOSET AND BROKEN APPLIANCES IN OUTSIDE AREA NEAR DUMPSTER. INSTRUCTED PERSON IN CHARGE TO REMOVE ALL UNUSED ARTICLES AND EQUIPMENT TO PREVENT PEST HARBORAGE.         | 55. PHYSICAL FACILITIES INSTALLED, MAINTAINED & CLEAN - Comments: OBSERVED THE CEILING IN  REAR STORAGE AREAS IN POOR REPAIR WITH AREAS OF EXPOSURE DUE TO UNFINISHED CEILING AND WATER DAMAGE. MUST REPAIR AND PROVIDE CEILING TILES THAT ARE A NON-ABSORBENT, NON-CORROSIVE, SMOOTH, EASILY CLEANABLE SURFACE. MUST REPLACE STAINED CEILING TILES] IN EMPLOYEE WASHROOM.",41.7516745503046,-87.56219874592,SOUTH SHORE CELLULAR MORE INC,2541 E 79TH ST,POINT (-87.56219874592 41.7516745503046),SOUTH CHICAGO,93272185.0092,46.0,46.0,52435.9794313,,,45.0,SOUTH CHICAGO,93272185.0092,46.0,46.0,52435.9794313
"Lion'S Market, Inc",2018-08-27,Pass W/ Conditions,FALSE,TRUE,TRUE,8201 S Exchange Ave,CHICAGO,IL,60617.0,"3. MANAGEMENT, FOOD EMPLOYEE AND CONDITIONAL EMPLOYEE; KNOWLEDGE, RESPONSIBILITIES AND REPORTING - Comments: 2-102.14(N) NO EMPLOYEE HEALTH POLICY ON PREMISES AS REQUIRED; MUST PROVIDE. INSTRUCTED THE PIC TO PROVIDE DOCUMENTATION OF EMPLOYEES RESPONSIBILITY TO REPORT ANY ILLNESS TRANSMISSIBLE THROUGH FOOD. PRIORITY FOUNDATION VIOLATION 7-38-012(A). | 5. PROCEDURES FOR RESPONDING TO VOMITING AND DIARRHEAL EVENTS - Comments: : 2-501.11 NO VOMIT AND DIARRHEAL CLEAN UP PROCEDURE ON PREMISES AS REQUIRED; MUST PROVIDE. INSTRUCTED THE PIC THAT A VOMIT AND DIARRHEAL CLEAN UP PROCEDURE MUST BE DOCUMENTED AND THE NECESSARY SUPPLIES ON HAND IN THE EVENT OF A VOMIT AND DIARRHEAL INCIDENT ON PREMISES. PRIORITY FOUNDATION VIOLATION 7-38-005. | 38. INSECTS, RODENTS, & ANIMALS NOT PRESENT - Comments: 6-202.16 CORE..OBSERVED A 1/4 INCH OPENING AT THE BOTTOM OF THE FRONT ENTRANCE DOOR; INSTRUCTED TO SEAL OPENING TO AVOID POSSIBLE RODENT ENTRY. 7-38-020. | 55. PHYSICAL FACILITIES INSTALLED, MAINTAINED & CLEAN - Comments: 6-201.13(A) OBSERVED LOOSE WALL COVING AT THE BASE OF THE WALL IN THE REAR STORAGE AREA; REATTACH WHERE NEEDED. PROVIDE A FLOOR DRAIN COVER FOR THE DRAIN IN THE WALK-IN COOLER. | 55. PHYSICAL FACILITIES INSTALLED, MAINTAINED & CLEAN - Comments: 6-201.11 FLOOR INSIDE OF WALK IN COOLER NOT SMOOTH AND EASILY CLEANABLE; MUST BE SMOOTH AND EASILY CLEANABLE. | 55. PHYSICAL FACILITIES INSTALLED, MAINTAINED & CLEAN - Comments: 6-501.11 OBSERVED HOLES IN THE WALL IN THE STORAGE ROOM IN THE PREP AREA; SEAL OPENINGS WHERE NEEDED. | 55. PHYSICAL FACILITIES INSTALLED, MAINTAINED & CLEAN - Comments: 6-201.17 OBSERVED DUST ON THE VENITLATION FAN ON THE WALL IN THE WASHROOM; CLEAN VENT FAN. | 56. ADEQUATE VENTILATION & LIGHTING; DESIGNATED AREAS USED - Comments: 6-501.14(A) OBSERVED THE EXHAUST SYSTEM IN THE REAR AREA IN NEED OF CLEANING; MUST CLEAN AND MAINTAIN. NO EQUIPMENT NOTED AT TIME OF INSPECTION UNDERNEATH HOODED SYSTEM.",41.7464125724861,-87.5526464889596,LIONS MARKET INC,8201 S EXCHANGE AVE,POINT (-87.5526464889596 41.7464125724861),SOUTH CHICAGO,93272185.0092,46.0,46.0,52435.9794313,,,45.0,SOUTH CHICAGO,93272185.0092,46.0,46.0,52435.9794313
Abood Food Market Inc.,2025-02-27,Pass,FALSE,TRUE,TRUE,8209 S Exchange Ave,CHICAGO,IL,60617.0,"39. CONTAMINATION PREVENTED DURING FOOD PREPARATION, STORAGE & DISPLAY - Comments: OBSERVED SEASONINGS NOT COVERED IN REAR PREP AREA. INSTRUCTED MANAGER TO PROPERLY COVER ALL FOOD ITEMS TO PREVENT CONTAMINATION. | 40. PERSONAL CLEANLINESS - Comments: OBSERVED FOOD HANDLERS NOT WEARING HAIR RESTRAINTS. ALL FOOD HANDLERS MUST WEAR EFFECTIVE HAIR RESTRAINTS. | 41. WIPING CLOTHS: PROPERLY USED & STORED - Comments: OBSERVED SOILED WIPING CLOTHS ON PREP TABLES. INSTRUCTED MANAGER TO STORE WIPING CLOTHS IN SANITIZING SOLUTION BETWEEN USES. | 47. FOOD & NON-FOOD CONTACT SURFACES CLEANABLE, PROPERLY DESIGNED, CONSTRUCTED & USED - Comments: OBSERVED ICE BUILDUP INSIDE MEAT COOLER. INSTRUCTED MANAGER TO REPAIR AND MAINTAIN. | 49. NON-FOOD/FOOD CONTACT SURFACES CLEAN - Comments: OBSERVED FOOD DEBRIS ON INTERIOR AND EXTERIOR SURFACES OF DISPLAY COOLERS, PREP COOLERS, REACH-IN COOLERS, FREEZERS, HOLDING UNITS, SHELVING UNITS, PREP TABLES, COOKING EQUIPMENT, SINKS, BULK CONTAINERS. INSTRUCTED MANAGER TO CLEAN AND MAINTAIN. | 55. PHYSICAL FACILITIES INSTALLED, MAINTAINED & CLEAN - Comments: OBSERVED MOP HEADS STORED ON FLOOR IN PREP AND STORAGE AREAS. INSTRUCTED MANAAGER TO PROPERLY HANG MOP HEADS TO PREVENT INSECT BREEDING. | 55. PHYSICAL FACILITIES INSTALLED, MAINTAINED & CLEAN - Comments: OBSERVED DEBRIS ON FLOOR UNDER ALL EQUIPMENT, ALONG WALLS AND IN ALL CORNERS IN PREP, FURNACE ROOM, AND STORAGE AREAS. INSTRUCTED MANAGER TO CLEAN AND MAINTAIN. | 56. ADEQUATE VENTILATION & LIGHTING; DESIGNATED AREAS USED - Comments: OBSERVED WINDOW COVERED IN WASHROOM. INSTRUCTED MANAGER TO PROVIDE ACCESS TO WINDOW OR MECHANICAL VENTILATION IN WASHROOM. | 56. ADEQUATE VENTILATION & LIGHTING; DESIGNATED AREAS USED - Comments: OBSERVED MISSING LIGHT SHIELDS IN PREP AREA. INSTRUCTED MANAGER TO REPLACE AND MAINTAIN.",41.7461598765571,-87.5526417191508,ABOOD FOOD MARKET INC,8209 S EXCHANGE AVE,POINT (-87.5526417191508 41.7461598765571),SOUTH CHICAGO,93272185.0092,46.0,46.0,52435.9794313,,,45.0,SOUTH CHICAGO,93272185.0092,46.0,46.0,52435.9794313
South Shore Food Mart Inc.,2024-12-03,Pass,TRUE,FALSE,FALSE,7900 S South Shore Dr,CHICAGO,IL,60617.0,"16. FOOD-CONTACT SURFACES: CLEANED & SANITIZED - Comments: OBSERVED RESIDUE ON INTERIOR SURFACES OF ICE MACHINE. INSTRUCTED MANAGER TO CLEAN AND MAINTAIN. | 39. CONTAMINATION PREVENTED DURING FOOD PREPARATION, STORAGE & DISPLAY - Comments:  OBSERVED CANDY STORED ON FLOOR BEHIND FRONT COUNTER. INSTRUCTED MANAGER TO ELEVATE ALL FOOD ITEMS SIX INCHES OFF FLOOR. | 49. NON-FOOD/FOOD CONTACT SURFACES CLEAN - Comments: OBSERVED GREASE BUILDUP AND FOOD DEBRIS ON INTERIOR AND EXTERIOR SURFACES OF COOKING EQUIPMENT, PREP TABLES, COOLERS, FREEZER, SHELVING UNITS. INSTRUCTED MANAGER TO CLEAN AND MAINTAIN. | 51. PLUMBING INSTALLED; PROPER BACKFLOW DEVICES - Comments:   OBSERVED NO BACKFLOW DEVICE ON UTILITY SINK. INSTRUCTED MANAGER TO PROVIDE AND MAINTAIN. | 56. ADEQUATE VENTILATION & LIGHTING; DESIGNATED AREAS USED - Comments:  OBSERVED GREASE BUILDUP INSIDE VENTILATION HOOD. INSTRUCTED MANAGER TO CLEAN AND MAINTAIN.",41.751855602467,-87.5482503373389,SOUTH SHORE FOOD MART INC,7900 S SOUTH SHORE DR,POINT (-87.5482503373389 41.751855602467),SOUTH CHICAGO,93272185.0092,46.0,46.0,52435.9794313,,,45.0,SOUTH CHICAGO,93272185.0092,46.0,46.0,52435.9794313
Macias Produce Inc.,2024-05-15,Pass,FALSE,TRUE,TRUE,8933 S Commercial Ave,CHICAGO,IL,60617.0,"16. FOOD-CONTACT SURFACES: CLEANED & SANITIZED - Comments:  OBSERVED RESIDUE ON INTERIOR SURFACES OF ICE MACHINE. INSTRUCTED MANAGER TO CLEAN AND MAINTAIN. | 36. THERMOMETERS PROVIDED & ACCURATE - Comments:  OBSERVED NO THERMOMETER INSIDE HOT HOLDING UNIT IN TAQUERIA. INSTRUCTED MANAGER TO PROVIDE AND MAINTAIN. | 37. FOOD PROPERLY LABELED; ORIGINAL CONTAINER - Comments: OBSERVED BULK CONTAINERS NOT LABELED IN TAMALE PREP AREA. INSTRUCTED MANAGER TO LABEL ALL BULK CONTAINERS WITH COMMON NAME OF FOOD. | 39. CONTAMINATION PREVENTED DURING FOOD PREPARATION, STORAGE & DISPLAY - Comments: OBSERVED NO SPLASH GUARD BETWWEN HAND WASHING SINK AND PREP TABLE IN TAMALE PREP AREA. INSTRUCTED MANAGER TO PROVIDE AND MAINTAIN. | 45. SINGLE-USE/SINGLE-SERVICE ARTICLES: PROPERLY STORED & USED - Comments: OBSERVED SINGLE SERVICE CONTAINERS AND UTENSILS NOT INVERTED IN TAQUERIA. INSTRUCTED MANAGER TO INVERT ALL SINGLE SERVICE ARTILCES TO PROTECT FROM CONTAMINATION. | 47. FOOD & NON-FOOD CONTACT SURFACES CLEANABLE, PROPERLY DESIGNED, CONSTRUCTED & USED - Comments: OBSERVED PLASTIC USED FOR SINK STOPPERS IN 3-COMPARMENT SINKS IN FRONT AND REAR PREP AREAS. INSTRUCTED MANAGER TO REPAIR OR PROVIDE ADEQUATE STOPPERS FOR 3-COMPARMTMENT SINKS. | 47. FOOD & NON-FOOD CONTACT SURFACES CLEANABLE, PROPERLY DESIGNED, CONSTRUCTED & USED - Comments:  OBSERVED DEEP GROOVED CUTTING BOARDS IN MEAT PREP AREA. INSTRUCTED MANAGER TO REPLACE AND MAINTAIN. | 52. SEWAGE & WASTE WATER PROPERLY DISPOSED - Comments: OBSERVED CONDENSATION LINE DRAINING INSIDE 3-CONPARTMENT SINK IN TAMALE PREP AREA. INSTRUCTED MANAGER TO REMOVE AND PROPERLY CONNECT DRAINLINE TO FLOOR DRAIN. | 53. TOILET FACILITIES: PROPERLY CONSTRUCTED, SUPPLIED, & CLEANED - Comments: OBSERVED NO COVERED WASTE RECEPTACLE IN WASHROOM ON SALES FLOOR. INSTRUCTED MANAGER TO PROVIDE. | 54. GARBAGE & REFUSE PROPERLY DISPOSED; FACILITIES MAINTAINED - Comments: OBSERVED NO WASTE RECEPTACLES AT HAND WASHING SINKS IN REAR PREP AREAS. INSTTRUCTED MANAGER TO PROVIDE WASTE RECEPTACLES IN ALL AREAS WASTE IS COMMONLY DISCARDED. | 55. PHYSICAL FACILITIES INSTALLED, MAINTAINED & CLEAN - Comments: OBSERVED DUST BUILDUP ON VENTILATION FANS IN WASHROOMS. INSTTRUCTED MANAGER TO CLEAN AND MAINTAIN. | 55. PHYSICAL FACILITIES INSTALLED, MAINTAINED & CLEAN - Comments:  OBSERVED STAINED CEILING TILES IN BASEMENT BREAKROOM AND EMPLOYEE WASHROOM, WATER DAMAGE AND OPENINGS IN CEILING IN BASEMENT STORAGE AREA. INSTRUCTED MANAGER TO REPAIR AND MAINTAIN.",41.7327335949484,-87.551172783557,MACIAS PRODUCE INC,8933 S COMMERCIAL AVE,POINT (-87.551172783557 41.7327335949484),SOUTH CHICAGO,93272185.0092,46.0,46.0,52435.9794313,,,45.0,SOUTH CHICAGO,93272185.0092,46.0,46.0,52435.9794313
Citgo,2024-01-04,Pass,TRUE,FALSE,FALSE,8903 S South Chicago Ave,CHICAGO,IL,60617.0,"10. ADEQUATE HANDWASHING SINKS PROPERLY SUPPLIED AND ACCESSIBLE - Comments: OBSERVED FACILITY MISSING HANDWASHING SIGNAGE AT THE HANDWASHING SINK IN THE WASHROOM AND DISHWASHING AREA. INSTRUCTED TO PROVIDE AND MAINTAIN. | 38. INSECTS, RODENTS, & ANIMALS NOT PRESENT - Comments: OBSERVED FLY STRIPS HANGING IN REAR DISH WASHING AREA. INSTRUCTED MANAGER TO REMOVE. | 48. WAREWASHING FACILITIES: INSTALLED, MAINTAINED & USED; TEST STRIPS - Comments:  OBSERVED THE FACILITY MISSING TWO SINIK STOPPERS FOR THE THREE COMPARTMENT SINK. INSTRUCTED TO PROVIDE AND MAINTAIN. | 49. NON-FOOD/FOOD CONTACT SURFACES CLEAN - Comments: OBSERVED THE MICROWAVE IN THE FORMER RESTAURANT AREA AND BEHIND THE SERVICE COUNTER WITH SEVERE FOOD DERBIS ANS NOT MAINTAINED. INSTRUCTED TO CLEAN SAID MICROWAVES AND MAINTAIN. | 55. PHYSICAL FACILITIES INSTALLED, MAINTAINED & CLEAN - Comments: OBSERVED CLUTTER INSIDE UNUSED PREP AREA AND ICE MACHINE IN REAR DISH WASHING AREA. INSTRUCTED MANAGER TO REMOVE ALL UNNECESSARY ITEMS TO PREVENT PEST HARBORAGE. | 55. PHYSICAL FACILITIES INSTALLED, MAINTAINED & CLEAN - Comments: OBSERVED THE FLOORS IN THE FOLLOWING AREAS WITH LIQUID SPILLAGE AND TRASH: UNDER THE SHELVING UNITS IN THE WALK-IN COOLER, BEHIND THE ICE MACHINE, BEHIND THE COFFEE STATION, AND UNDER THE CANDY SHELVING UNIT IN THE DISPLAY AISLE. INSTRUCTED TO CLEAN SAID FLOORS AND MAINTAIN. OBSERVED DEAD INSECTS INSIDE LIGHT SHIELDS IN DISH WASHING AREA AND STAINED CEILING TILES IN SALES AREA. INSTRUCTED MANAGER TO CLEAN/REPLACE AND MAINTAIN.",41.733646449027,-87.5605530337763,CITGO,8903 S SOUTH CHICAGO AVE,POINT (-87.5605530337763 41.733646449027),SOUTH CHICAGO,93272185.0092,46.0,46.0,52435.9794313,,,45.0,SOUTH CHICAGO,93272185.0092,46.0,46.0,52435.9794313
La Jerezana,2023-10-31,Pass,TRUE,FALSE,FALSE,3022 E 91St St,CHICAGO,IL,60617.0,"38. INSECTS, RODENTS, & ANIMALS NOT PRESENT - Comments:  6-202.15 : OBSERVED A GAP ALONG BOTTOM OF FRONT DOOR AND IN RIGHT CORNER OF REAR KITCHEN DOOR MUST MAKE DOORS TIGHT FITTING TO PREVENT RODENT ENTRY. | 39. CONTAMINATION PREVENTED DURING FOOD PREPARATION, STORAGE & DISPLAY - Comments:  3-307.11: OBSERVED NO SPLASH GUARD AT HAND SINK ON BOTH SIDES NEXT TO 3- COMP SINK AND COUNTER TOP.MUST PROVIDE AND MAINTAIN. | 47. FOOD & NON-FOOD CONTACT SURFACES CLEANABLE, PROPERLY DESIGNED, CONSTRUCTED & USED - Comments: 4-101.19 : OBSERVED CRATES BEING USED FOR STORAGE ON SALES FLOOR AND REAR KITCHEN MUST ELIMINATE AND PROVIDE ADEQUATE SHELVING UNITS | 49. NON-FOOD/FOOD CONTACT SURFACES CLEAN - Comments:  4-601.11(C) : MUST CLEAN DEBRIS BUILD UP ON SOME SHELVING UNITS INSIDE OF REACH IN COOLER.MUST DEFROST ICE BUILD UP FROM ICE CREAM FREEZER. | 55. PHYSICAL FACILITIES INSTALLED, MAINTAINED & CLEAN - Comments:  6-201.13 : MUST REPAIR OR REPLACE SOME DAMAGED FLOOR TILES ON SALES FLOOR | 57. ALL FOOD EMPLOYEES HAVE FOOD HANDLER TRAINING - Comments:  2-102.13 : OBSERVED NO FOOD HANDLERS TRAINING FOR FEMALE EMPLOYEE MUST PROVIDE AND MAINTAIN.",41.730198538353,-87.5502064784261,LA JEREZANA,3022 E 91ST ST,POINT (-87.5502064784261 41.730198538353),SOUTH CHICAGO,93272185.0092,46.0,46.0,52435.9794313,,,45.0,SOUTH CHICAGO,93272185.0092,46.0,46.0,52435.9794313
Star Food Market,2023-08-08,Pass,TRUE,FALSE,FALSE,9125 S Commercial Ave,CHICAGO,IL,60617.0,"49. NON-FOOD/FOOD CONTACT SURFACES CLEAN - Comments:  4-601.11(C) : MUST CLEAN DEBRIS AND MOLD BUILD UP FROM ALL INTERIOR PARTS OF REACH IN COOLERS AND FREEZERS. | 54. GARBAGE & REFUSE PROPERLY DISPOSED; FACILITIES MAINTAINED - Comments:  5-501.111 : OBSERVED OUTSIDE REAR YARD WITH EXCESSIVELY OVER GROWN TALL WEEDS ,ON STAIRS LEADING TO BASEMENT AND INTO REAR DOOR OF BUSINESS.MUST REMOVE AND MAINTAIN AREA. | 55. PHYSICAL FACILITIES INSTALLED, MAINTAINED & CLEAN - Comments:  6-201.13 : MUST REPAIR OR REPLACE STAINED CEILING TILES,MISSING AND DAMAGED WOOD FLOORING IN STORAGE AREAS & FLOOR TILES THROUGHOUT PREMISES,HOLES IN WALLS,HOLE IN FLOOR AROUND PIPE OF MOP SINK,MOLDED VANITY UNDERNEATH 2- COMPARTMENT SINK. | 55. PHYSICAL FACILITIES INSTALLED, MAINTAINED & CLEAN - Comments:  6-201.17 : MUST CLEAN DEBRIS BUILD UP IN LIGHT SHIELD IN REAR STORAGE AREA. | 56. ADEQUATE VENTILATION & LIGHTING; DESIGNATED AREAS USED - Comments:  6-202.11 : MUST REPLACE BURNTOUT LIGHT ABOVE SERVICE COUNTER. | 56. ADEQUATE VENTILATION & LIGHTING; DESIGNATED AREAS USED - Comments:  6-304.11 : OBSERVED NO MECHANICAL VENTILATION IN TOILET ROOM MUST PROVIDE AND MAINTAIN.",41.7293063126454,-87.5510913369374,STAR FOOD MARKET,9125 S COMMERCIAL AVE,POINT (-87.5510913369374 41.7293063126454),SOUTH CHICAGO,93272185.0092,46.0,46.0,52435.9794313,,,45.0,SOUTH CHICAGO,93272185.0092,46.0,46.0,52435.9794313
The Guys Convenience,2023-03-17,Pass,TRUE,FALSE,TRUE,9140 S Commercial Ave,CHICAGO,IL,60617.0,"38. INSECTS, RODENTS, & ANIMALS NOT PRESENT - Comments: Inspector Comments: OBSERVED A GAP ALONG BOTTOM OF REAR EMERGENCY DOOR MUST MAKE DOOR TIGHT FITTING. | 47. FOOD & NON-FOOD CONTACT SURFACES CLEANABLE, PROPERLY DESIGNED, CONSTRUCTED & USED - Comments: Inspector Comments: MUST REMOVE RUST FROM SHELVING UNITS IN COLD HOLDING COOLERS ON SALES FLOOR. | 49. NON-FOOD/FOOD CONTACT SURFACES CLEAN - Comments: Inspector Comments: MUST REMOVE SPIDER WEBS FROM LOWER WALL AND WINDOW SILLS ON SALES FLOOR,SOILED LIGHT SHIELDS IN REAR STORAGE AREA. | 55. PHYSICAL FACILITIES INSTALLED, MAINTAINED & CLEAN - Comments: Inspector Comments: MUST REPAIR OR REPLACE DAMAGED FLOOR TILES IN TOILET ROOM AND UNDER 1- COMPARTMENT SINK,STAINED CEILING TILES THROUGHOUT PREMISES. | 55. PHYSICAL FACILITIES INSTALLED, MAINTAINED & CLEAN - Comments: Inspector Comments: MUST CLEAN DEBRIS FROM FLOOR UNDER SOME DISPLAY SHELVES ON SALES FLOOR AND UNDER SHELVING UNITS IN REAR STORAGE AREA. | 56. ADEQUATE VENTILATION & LIGHTING; DESIGNATED AREAS USED - Comments: Inspector Comments: MUST REPLACE SOME BURNTOUT LIGHTS IN REAR STORAGE AREA.",41.7288484800821,-87.5513724241019,THE GUYS CONVENIENCE,9140 S COMMERCIAL AVE,POINT (-87.5513724241019 41.7288484800821),SOUTH CHICAGO,93272185.0092,46.0,46.0,52435.9794313,,,45.0,SOUTH CHICAGO,93272185.0092,46.0,46.0,52435.9794313
Big Al'S Market,2018-02-23,Pass,TRUE,FALSE,FALSE,2253-2255 E 83Rd St,CHICAGO,IL,60617.0,"35. WALLS, CEILINGS, ATTACHED EQUIPMENT CONSTRUCTED PER CODE: GOOD REPAIR, SURFACES CLEAN AND DUST-LESS CLEANING METHODS - Comments: OBSERVED SOME PEELING PAINT ON THE WALLS OF THE REAR STORAGE AREA AND FURNACE ROOM; REMOVE PEELING PAINT FROM WALL AND REPAINT IF NEEDED. | 37. TOILET ROOM DOORS SELF CLOSING: DRESSING ROOMS WITH LOCKERS PROVIDED: COMPLETE SEPARATION FROM LIVING/SLEEPING QUARTERS - Comments: FOUND NO SELF CLOSING DEVICE ON THE WASHROOM DOOR; MUST PROVIDE/INSTALL A SELF CLOSING DEVICE ON THE WASHROOM DOOR.",41.744315945066,-87.5688675876901,BIG ALS MARKET,22532255 E 83RD ST,POINT (-87.5688675876901 41.744315945066),SOUTH CHICAGO,93272185.0092,46.0,46.0,52435.9794313,,,45.0,SOUTH CHICAGO,93272185.0092,46.0,46.0,52435.9794313
