DBA Name,Address,IS_JUNK_STORE,IS_REAL_GROCERY,HAS_PRODUCE_FLAG,City,State,Zip,Inspection Date,Results,Violations,Latitude,Longitude,DBA_NAME_CLEAN,ADDRESS_CLEAN,geometry,index_right,Community,shape_area,area_num_1,AreaNumber,shape_len,IS_REVIEWED_REAL,REVIEW_NOTES,Action,Notes
Carniceria La Hacienda No 2 Inc,3629 W 63Rd St,TRUE,FALSE,TRUE,CHICAGO,IL,60629.0,2024-08-08,Pass,"35. APPROVED THAWING METHODS USED - Comments: FROZEN REDUCED OXYGEN PACKAGED FISH BEING OFFERED FOR SALE IN REFRIGERATED DISPLAY CASE. (LABEL INDICATING KEEP FROZEN)  REDUCED OXYGEN PACKAGED FISH that bears a label indicating  that it is to be kept frozen until time of use shall be removed from the  reduced oxygen environment prior to its thawing under refrigeration.  | 39. CONTAMINATION PREVENTED DURING FOOD PREPARATION, STORAGE & DISPLAY - Comments: MISSING SPLASHGUARD INBETWEEN HANDWASH SINK AND 3-COMPARTMENT SINK AT FRONT MEAT PREP AREA. INSTD TO PROVIDE SPLASHGUARD AND MAINTAIN | 55. PHYSICAL FACILITIES INSTALLED, MAINTAINED & CLEAN - Comments: FLOOR IN DELI/MEAT SERVICE AREA AND IN TOILET ROOM WITH WORN, UNEVEN SURFACES. INSTD TO REPAIR FLOOR SO AS SURFACE TO BE EVEN, EASILY CLEANABLE AND NON POROUS.",41.7786847161993,-87.7142516633047,CARNICERIA LA HACIENDA NO 2 INC,3629 W 63RD ST,POINT (-87.7142516633047 41.7786847161993),64.0,WEST LAWN,82315301.6831,65.0,65.0,41934.4901309,,,,
El Buen San Pedrano,3852 W 63Rd St,TRUE,FALSE,FALSE,CHICAGO,IL,60629.0,2024-12-02,Pass,"47. FOOD & NON-FOOD CONTACT SURFACES CLEANABLE, PROPERLY DESIGNED, CONSTRUCTED & USED - Comments: RAW WOOD SURFACE AT FRONT COUNTER. INSTD TO SEAL RAW WOOD SO AS SURFACE TO BE SMOOTH, NON POROOUS AND EASILY CLEANABLE | 51. PLUMBING INSTALLED; PROPER BACKFLOW DEVICES - Comments: NO SERVICE/UTILITY SINK ON SITE. INSTD TO PROVIDE SERVICE/UTILITY SINK OBTAININ AND DISPOSING OF MOP/CLEANING WATER AND MAINTAIN",41.7788101854085,-87.7199592721113,EL BUEN SAN PEDRANO,3852 W 63RD ST,POINT (-87.7199592721113 41.7788101854085),64.0,WEST LAWN,82315301.6831,65.0,65.0,41934.4901309,,,,
El Ranchito Food Market,3900-3904 W 71St,FALSE,TRUE,TRUE,CHICAGO,IL,60629.0,2024-08-07,Pass W/ Conditions,"10. ADEQUATE HANDWASHING SINKS PROPERLY SUPPLIED AND ACCESSIBLE - Comments: MISSING HANDWASH SIGNAGE AT HANDWASH SINKS IN PREP AREAS AND TOILET ROOMS. INSTD TO PROVIDE SIGNAGE AT HANDWASH SINKS AND MAINTAIN | 10. ADEQUATE HANDWASHING SINKS PROPERLY SUPPLIED AND ACCESSIBLE - Comments: HANDWASH SINK IN MEAT/DELI SERVICE PREP AREA NOT ACCESSIBLE. LARGE TRASH RECEPTACLE IN FRONT OF SINK. REAR HANDWASH SINK NOT ACCESSIBLE, WATER TURNED OFF FROM UNDERNEATH. DURING INSPECTION TRASH RECEPTACLE REMOVED FROM SAME AREA AND WATER TURNED ON AND  ACCESSSIBLE FROM FAUCET AT REAR HANDWASH SINK. INSTD TO MAINTAIN. PRIORITY FOUNDATION 7-38-030(C) CITATION ISSUED | 10. ADEQUATE HANDWASHING SINKS PROPERLY SUPPLIED AND ACCESSIBLE - Comments: NO HAND DRYING PROVISION AT HANDWASH SINK IN REAR EMPLOYEE TOILET ROOM. INSTD TO PROVIDE AT ALL TIMES. PAPER TOWELS PROVIDED DURING INSPECTION. PRIORITY FOUNDATION 7-38-030(C). SEE ABOVE FOR VIOLATION ISSUED | 39. CONTAMINATION PREVENTED DURING FOOD PREPARATION, STORAGE & DISPLAY - Comments: SPLASHGUARD MISSING INBETWEEN 3-COMPARTMENT SINK AND PREP SINK. INSTD TO PROVIDE SPLASGUARD AND MAINTAIN | 44. UTENSILS, EQUIPMENT & LINENS: PROPERLY STORED, DRIED, & HANDLED - Comments: KNIVES IMPROPER STORED INBETWEEN WALL AND 3-COMPARTMENT SINK. INSTD TO REMOVE FROM AREA AND STORE PROPERLY. CUTTING BOARDS BEING STORED ON FLOOR IN REAR. INSTD TO ELEVATE AND STORE PROPERLY | 47. FOOD & NON-FOOD CONTACT SURFACES CLEANABLE, PROPERLY DESIGNED, CONSTRUCTED & USED - Comments: ALUMINUM FOIL ON BOTTOM SHELF OF PREP TABLES IN BUTCHER PREP AREA. INSTD TO REMOVE FOIL SO AS SURFACE TO BE SMOOTH, EVEN AND EASILY CLEANABLE. | 55. PHYSICAL FACILITIES INSTALLED, MAINTAINED & CLEAN - Comments: NON USED MEAT GRINDER IN WALK IN COOLER. INSTD TO REMOVE FROM PREMISES AND MAINTAIN.",41.7642365870386,-87.7200098732956,EL RANCHITO FOOD MARKET,39003904 W 71ST,POINT (-87.7200098732956 41.7642365870386),64.0,WEST LAWN,82315301.6831,65.0,65.0,41934.4901309,,,,
K-Buena Super Market Inc,4324 W Marquette Rd,FALSE,TRUE,TRUE,CHICAGO,IL,60629.0,2025-04-18,Pass,,41.7713825032114,-87.731044361648,KBUENA SUPER MARKET INC,4324 W MARQUETTE RD,POINT (-87.731044361648 41.7713825032114),64.0,WEST LAWN,82315301.6831,65.0,65.0,41934.4901309,,,,
La Palma Supermercado,3927-3929 W 63Rd St,FALSE,TRUE,TRUE,CHICAGO,IL,60629.0,2025-04-11,Pass,51. PLUMBING INSTALLED; PROPER BACKFLOW DEVICES - Comments: 5-205.15: LOOOSE FAUCET AT HANDWASH SINK IN MENS TOILET ROOM. INSTD TO REPAIR AND MAINTAIN,41.7785673292022,-87.7214163289382,LA PALMA SUPERMERCADO,39273929 W 63RD ST,POINT (-87.7214163289382 41.7785673292022),64.0,WEST LAWN,82315301.6831,65.0,65.0,41934.4901309,,,,
La Paloma Grocery Store,4324 W 63Rd St,TRUE,FALSE,FALSE,CHICAGO,IL,60629.0,2024-10-31,Pass,"53. TOILET FACILITIES: PROPERLY CONSTRUCTED, SUPPLIED, & CLEANED - Comments: MISSING COVER ON TRASH RECEPTACLE IN TOILET ROOM. INSTD TO PROVIDE COVER AND MAINTAIN | 55. PHYSICAL FACILITIES INSTALLED, MAINTAINED & CLEAN - Comments: WALLS IN REAR PREP/WAREWASHING AREA NOT CLEAN, DEBRIS. INSTD TO CLEAN AND MAINTAIN SAME",41.7786686510764,-87.7311596465763,LA PALOMA GROCERY STORE,4324 W 63RD ST,POINT (-87.7311596465763 41.7786686510764),64.0,WEST LAWN,82315301.6831,65.0,65.0,41934.4901309,,,,
Nopalitos Carrillo Grocery,5916 S Pulaski,TRUE,FALSE,FALSE,CHICAGO,IL,60629.0,2013-07-03,Pass,,41.7854532974205,-87.7230943007696,NOPALITOS CARRILLO GROCERY,5916 S PULASKI,POINT (-87.7230943007696 41.7854532974205),64.0,WEST LAWN,82315301.6831,65.0,65.0,41934.4901309,,,,