DBA Name,Address,IS_JUNK_STORE,IS_REAL_GROCERY,HAS_PRODUCE_FLAG,City,State,Zip,Inspection Date,Results,Violations,Latitude,Longitude,DBA_NAME_CLEAN,ADDRESS_CLEAN,geometry,index_right,Community,shape_area,area_num_1,AreaNumber,shape_len,IS_REVIEWED_REAL,REVIEW_NOTES,Action,Notes
Blink Fitness,5160 S Pulaski Rd,TRUE,FALSE,FALSE,CHICAGO,IL,60632.0,2019-10-16,Pass W/ Conditions,5. PROCEDURES FOR RESPONDING TO VOMITING AND DIARRHEAL EVENTS - Comments: 2-501.11: NO PROCEDURE IN PLACE FOR RESPONDING TO VOMITING AND DIARRHEAL EVENTS. INSTD TO PROVIDE PROCEDURE AND NECESSARY SUPPLIES EFFECTIVE AGAINST NOROVIRUS. PRIORITY FOUNDATION 7-38-005. | 36. THERMOMETERS PROVIDED & ACCURATE - Comments:  4-302.12: MISSING FOOD TEMPERATURE MEASURING DEVICE FOR VERIFYING RECEIVING OF COLD TCS FOODS (41F OR BELOW). INSTD TO PROVIDE AND MAINTAIN ON SITE. PRIORITY FOUNDATION 7-38-005 | 36. THERMOMETERS PROVIDED & ACCURATE - Comments: 4-204.112(B): MISSING THERMOMETER FOR REFRIGERATOR. INSTD TO PROVIDE AND MAINTAIN SAME.,41.7987502574327,-87.7234664101888,BLINK FITNESS,5160 S PULASKI RD,POINT (-87.7234664101888 41.7987502574327),61.0,WEST ELSDON,32711091.4259,62.0,62.0,26229.6956007,,,,
Cermak Produce,5220 S Pulaski Rd,FALSE,TRUE,TRUE,CHICAGO,IL,60632.0,2024-05-03,Pass,49. NON-FOOD/FOOD CONTACT SURFACES CLEAN - Comments: OBSERVED CARTS FOR TRANSPORTING FOOD TO HAVE BUILD UP OF RUST. INSTRUCTED PERSON IN CHARGE TO CLEAN OR REPLACE. | 51. PLUMBING INSTALLED; PROPER BACKFLOW DEVICES - Comments: OBSERVED LEAKING HANDSINK IN DELI/MEAT AREA(FRONT SINK NEAR HOT HOLDING). INSTRUCTED PERSON IN CHARGE TO REPAIR AND MAINTAIN.  | 56. ADEQUATE VENTILATION & LIGHTING; DESIGNATED AREAS USED - Comments: OBSERVED BROKEN LIGHT SHIELD IN MEAT DEPARTMENT STOCK WALK IN COOLER. INSTRUCTED PERSON IN CHARGE TO REPAIR AND MAINTAIN.,41.7979918699622,-87.723443740796,CERMAK PRODUCE,5220 S PULASKI RD,POINT (-87.723443740796 41.7979918699622),61.0,WEST ELSDON,32711091.4259,62.0,62.0,26229.6956007,,,,
Jewel Food Store #3170,5320 S Pulaski Rd,FALSE,TRUE,TRUE,CHICAGO,IL,60632.0,2025-01-10,Pass,"55. PHYSICAL FACILITIES INSTALLED, MAINTAINED & CLEAN - Comments: OBSERVED DAMAGED CEILING TILE IN 2ND FL WOMEN'S RESTROOM (2 STALL RESTROOM), OBSERVED DAMAGE CEILING TILE IN BAKERY AREA NEAR HIGH TEMP DISH MACHINE. INSTRUCTED PERSON IN CHARGE TO REPAIR AND MAINTAIN.   | 55. PHYSICAL FACILITIES INSTALLED, MAINTAINED & CLEAN - Comments: OBSERVED BUILD UP OF EXCESSIVE GRIME UNDERNEATH DISH MACHINE. INSTRUCTED PERSON IN CHARGE TO DETAIL CLEAN AND MAINTAIN. | 55. PHYSICAL FACILITIES INSTALLED, MAINTAINED & CLEAN - Comments: OBSERVED LARGE HOLE IN WALL OUSTIDE 2ND FLOOR WOMEN'S RESTROOM. INSTRUCTED PERSON IN CHARGE TO REPAIR AND MAINTAIN.",41.796197591415500,-87.7233918834455,JEWEL FOOD STORE 3170,5320 S PULASKI RD,POINT (-87.7233918834455 41.796197591415506),61.0,WEST ELSDON,32711091.4259,62.0,62.0,26229.6956007,,,,
La Ramoncita Grocery Store,4302 W 55Th St,TRUE,FALSE,FALSE,CHICAGO,IL,60632.0,2021-01-22,Ouf Of Business,"5. PROCEDURES FOR RESPONDING TO VOMITING AND DIARRHEAL EVENTS - Comments: NO PROCEDURE IN PLACE FOR RESPONDING TO VOMITING AND DIARRHEAL EVENTS. INSTD TO PROVIDE PROCEDURE AND NECESSARY SUPPLIES EFFECTIVE AGAINST NOROVIRUS. PRIORITY FOUNDATION 7-38-005 | 10. ADEQUATE HANDWASHING SINKS PROPERLY SUPPLIED AND ACCESSIBLE - Comments: MISSING HANDWASH SIGNAGE AT HANDWASH SINK. INSTD TO PROVIDE AND MAINTAIN | 47. FOOD & NON-FOOD CONTACT SURFACES CLEANABLE, PROPERLY DESIGNED, CONSTRUCTED & USED - Comments: RAW WOOD SURFACE AT FRONT COUNTER AND CARDBOARD LINING ON DISPLAY SHELVES. INSTD TO SEAL WOOD AND REMOVE CARDBOARD, SO AS TO BE SMOOTH, NON ABSORBANT AND EASILY CLEANABLE | 53. TOILET FACILITIES: PROPERLY CONSTRUCTED, SUPPLIED, & CLEANED - Comments: MISSING COVER FOR RECEPTACLE IN TOILET ROOM. INSTD TO PROVIDE AND MAINTAIN.",41.7932455476462,-87.7306680910664,LA RAMONCITA GROCERY STORE,4302 W 55TH ST,POINT (-87.7306680910664 41.7932455476462),61.0,WEST ELSDON,32711091.4259,62.0,62.0,26229.6956007,,,,
Pete'S Market #4,5838 S Pulaski Rd,FALSE,TRUE,TRUE,CHICAGO,IL,60629.0,2024-10-10,Pass,"47. FOOD & NON-FOOD CONTACT SURFACES CLEANABLE, PROPERLY DESIGNED, CONSTRUCTED & USED - Comments: 4-501.12: HEAVILY STAINED CUTTING BOARDS WITH DEEP, DARK GROOVES IN PRODUCE PREP AREA. INSTD TO REPLACE AND MAINTAIN CUTTING BOARDS | 55. PHYSICAL FACILITIES INSTALLED, MAINTAINED & CLEAN - Comments: 6-201.11: FLOOR IN POOR REPAIR IN REAR MEAT PREP AREA, HEAVILY WORN AND MISSING FLOOR SURFACE CAUSING STANDING WATER/DEBRIS ON FLOOR. INSTD TO REPAIR FLOOR SO AS TO BE SMOOTH, EVEN, AND EASILY CLEANABLE",41.78660840950230,-87.7231300288952,PETES MARKET 4,5838 S PULASKI RD,POINT (-87.7231300288952 41.78660840950231),61.0,WEST ELSDON,32711091.4259,62.0,62.0,26229.6956007,,,,