DBA Name,Inspection Date,Results,IS_JUNK_STORE,IS_REAL_GROCERY,HAS_PRODUCE_FLAG,Address,City,State,Zip,Violations,Latitude,Longitude,DBA_NAME_CLEAN,ADDRESS_CLEAN,geometry,index_right,Community,shape_area,area_num_1,AreaNumber,shape_len,IS_REVIEWED_REAL,REVIEW_NOTES
La Placita,2024-04-18,Pass,TRUE,FALSE,FALSE,1840 W 35Th St,CHICAGO,IL,60609.0,58. ALLERGEN TRAINING AS REQUIRED - Comments: 2-102.13 OBSERVED NO CERTIFIED FOOD MANAGER WITH ALLERGEN TRAINING. INSTRUCTED ANY PERSONS WITH THE CITY OF CHICAGO FOOD SANITATION CERTIFICATE TO COMPLY WITH COMPLETION OF TRAINING. MUST PROVIDE DOCUMENTATION.,41.8305361441811,-87.6720785647458,LA PLACITA,1840 W 35TH ST,POINT (-87.6720785647458 41.8305361441811),58.0,MCKINLEY PARK,39431799.6479,59.0,59.0,26014.0968371,,
C & C Packing Corporation,2014-10-30,Out Of Business,TRUE,FALSE,FALSE,3310 S Archer Ave,CHICAGO,IL,60608.0,,41.8338678995095,-87.6722063577332,C C PACKING CORPORATION,3310 S ARCHER AVE,POINT (-87.6722063577332 41.8338678995095),58.0,MCKINLEY PARK,39431799.6479,59.0,59.0,26014.0968371,,
Marathon,2012-12-31,Pass,TRUE,FALSE,FALSE,1810 W 35Th St,CHICAGO,IL,60609.0,"38. VENTILATION: ROOMS AND EQUIPMENT VENTED AS REQUIRED: PLUMBING: INSTALLED AND MAINTAINED - Comments: PROVIDE MECHANICAL VENTILATION IN TOILET ROOM. | 41. PREMISES MAINTAINED FREE OF LITTER, UNNECESSARY ARTICLES, CLEANING  EQUIPMENT PROPERLY STORED - Comments: REMOVE CLUTTER UNNECESSARY ARTICLES IN REAR STORAGE AREA.",41.8305526094771,-87.670856531986,MARATHON,1810 W 35TH ST,POINT (-87.670856531986 41.8305526094771),58.0,MCKINLEY PARK,39431799.6479,59.0,59.0,26014.0968371,,
A & R Food,2012-06-26,Pass,TRUE,FALSE,FALSE,1657 W 35Th St,CHICAGO,IL,60609.0,,41.8303659007614,-87.6678056623866,A R FOOD,1657 W 35TH ST,POINT (-87.6678056623866 41.8303659007614),58.0,MCKINLEY PARK,39431799.6479,59.0,59.0,26014.0968371,,
"35Th & Ashland Oil, Inc.",2011-04-15,Pass,TRUE,FALSE,FALSE,3510 S Ashland Ave,CHICAGO,IL,60609.0,"30. FOOD IN ORIGINAL CONTAINER, PROPERLY LABELED: CUSTOMER ADVISORY POSTED AS NEEDED - Comments: All food not stored in the original container shall be stored in properly labeled containers. MUST PROVIDE LABELS FOR BAG ICE IN FREEZERS.",41.8301250664046,-87.6657058221924,35TH ASHLAND OIL INC,3510 S ASHLAND AVE,POINT (-87.6657058221924 41.8301250664046),58.0,MCKINLEY PARK,39431799.6479,59.0,59.0,26014.0968371,,
Paulina Foods,2010-11-19,Pass W/ Conditions,TRUE,FALSE,FALSE,3663 S Paulina St,CHICAGO,IL,60609.0,"32. FOOD AND NON-FOOD CONTACT SURFACES PROPERLY DESIGNED, CONSTRUCTED AND MAINTAINED - Comments: PAINT OR REPLACE ALL RUSTY STORAGE SHELVES AND RACKS IN REAR, ON SALES FLOOR AND INSIDE COOLERS.   | 33. FOOD AND NON-FOOD CONTACT EQUIPMENT UTENSILS CLEAN, FREE OF ABRASIVE DETERGENTS - Comments: CLEAN THE FOLLOWING: ALL SHELVES, RACKS, INTERIORS OF ALL COOLERS(USED AND UNUSED), FREEZERS, SINKS, COUNTERS AND ALL OTHER UNCLEAN SURFACES THROUGHOUT | 34. FLOORS: CONSTRUCTED PER CODE, CLEANED, GOOD REPAIR, COVING INSTALLED, DUST-LESS CLEANING METHODS USED - Comments: : DETAIL CLEAN ALL FLOORS THROUGHOUT ALONG ALL WALL BASES, UNDERNEATH AND BEHIND ALL HEAVY EQUIPMENT(INCLUDING BASEMENT). REPLACE MISSING FLOOR TILES WHERE NEEDED AND REPAIR SECTIONS OF FLOOR BEHIND COOLERS ON SOUTH WALL | 35. WALLS, CEILINGS, ATTACHED EQUIPMENT CONSTRUCTED PER CODE: GOOD REPAIR, SURFACES CLEAN AND DUST-LESS CLEANING METHODS - Comments: CLEAN AND PAINT ALL WALLS & PIPES THAT ARE NO LONGER EASILY CLEANABLE THROUGHOUT. CLEAN AND OR PAINT RUSTY LIGHT FIXTURES IN CEILINGS WHERE NEEDED AND CEILING WHERE NEEDED. REPAIR BOTTOMS OF ENTRY DOORS MAKING THEM TIGHT-FITTING TO PREVENT RODENT ENTRY | 38. VENTILATION: ROOMS AND EQUIPMENT VENTED AS REQUIRED: PLUMBING: INSTALLED AND MAINTAINED - Comments: REPAIR LEAK ON HOT WATER SIDE OF WASHBOWL IN WASHROOM | 40. REFRIGERATION AND METAL STEM THERMOMETERS PROVIDED AND CONSPICUOUS - Comments: MUST KEEP THERMOMETERS IN ALL COOLERS | 41. PREMISES MAINTAINED FREE OF LITTER, UNNECESSARY ARTICLES, CLEANING  EQUIPMENT PROPERLY STORED - Comments: ELIMINATE CLUTTER BEHIND, ALONG SIDE , AND ON TOP OF MEAT CASE.",41.8269165638491,-87.6677193452691,PAULINA FOODS,3663 S PAULINA ST,POINT (-87.6677193452691 41.8269165638491),58.0,MCKINLEY PARK,39431799.6479,59.0,59.0,26014.0968371,,